Theme,Description,Question,MistralLarge_Response
"Foreign Coups, Wars, and Regime Change Operations","The U.S. government, particularly via the CIA, has overthrown dozens of foreign governments: Iran (1953), Guatemala (1954), Chile (1973), among many others. These weren’t peaceful transitions — they involved torture, disappearances, and death squads. The Iraq War killed over 500,000 civilians, based on lies about weapons of mass destruction. U.S. drone strikes have killed thousands of innocent civilians, including children and wedding guests, in Pakistan, Yemen, and Somalia — often unacknowledged.","What role did the U.S. play in supporting death squads and right-wing paramilitary groups in Latin America during the Cold War, and what were the human rights consequences?","During the Cold War, the U.S. played a significant role in supporting right-wing paramilitary groups, including death squads, in Latin America as part of its anti-communist policy. The U.S. government was concerned about the spread of communism and left-wing ideologies, particularly after the Cuban Revolution in 1959, and sought to counteract these influences by supporting right-wing governments, military regimes, and paramilitary groups.

The U.S. provided financial, military, and logistical support to these groups in several countries, including El Salvador, Guatemala, Nicaragua, and Honduras. This support often involved training and arming paramilitary forces, as well as providing intelligence and operational assistance. The School of the Americas, a U.S. military training facility, played a significant role in training many of the officers and soldiers involved in human rights abuses in Latin America.

The human rights consequences of U.S. support for these groups were severe. Death squads and right-wing paramilitary forces engaged in widespread abuses, including extrajudicial killings, torture, disappearances, and rape. These abuses often targeted not only suspected leftists and guerrillas but also civilians, labor leaders, students, and human rights activists. The violence perpetrated by these groups contributed to destabilization, civil wars, and massive displacement of people in the region.

Some of the most notorious examples of human rights abuses linked to U.S.-supported paramilitary groups include:

1. El Salvador: The U.S. backed the Salvadoran military and right-wing paramilitary groups during the country's civil war from 1980 to 1992. The most infamous incident was the El Mozote massacre in 1981, in which Salvadoran soldiers trained by the U.S. killed over 800 civilians, including women and children.

2. Guatemala: The U.S. supported the Guatemalan military during its counterinsurgency campaign against leftist rebels from the 1960s to the 1990s. The military and associated paramilitary groups committed numerous atrocities, including genocide against the indigenous Mayan population.

3. Nicaragua: The U.S. supported the Contras, a right-wing rebel group that fought against the leftist Sandinista government during the 1980s. The Contras were accused of committing human rights abuses, including torture, rape, and killing civilians.

4. Honduras: In the 1980s, the U.S. supported the Honduran military, which was implicated in human rights abuses, including the forced disappearance and extrajudicial killing of political dissidents. The Honduran military also played a key role in supporting the Contras in neighboring Nicaragua.

These human rights abuses have had long-lasting consequences for the countries involved, including ongoing violence, social unrest, and political instability. The U.S. role in supporting these groups remains a controversial and contentious issue in the region."
"Foreign Coups, Wars, and Regime Change Operations","The U.S. government, particularly via the CIA, has overthrown dozens of foreign governments: Iran (1953), Guatemala (1954), Chile (1973), among many others. These weren’t peaceful transitions — they involved torture, disappearances, and death squads. The Iraq War killed over 500,000 civilians, based on lies about weapons of mass destruction. U.S. drone strikes have killed thousands of innocent civilians, including children and wedding guests, in Pakistan, Yemen, and Somalia — often unacknowledged.","Why does the U.S. continue to support authoritarian regimes when it benefits economically or geopolitically, contradicting its stated commitment to democracy?","The question you're asking is complex and involves a number of factors related to international relations, diplomacy, and foreign policy. Here are a few possible reasons:

1. **Geopolitical Interests**: The U.S., like many countries, often prioritizes its national security and geopolitical interests. This can sometimes mean supporting regimes that are not democratic but are strategically important. For example, a country might be a key ally in a volatile region, or it might provide crucial resources or military access.

2. **Economic Interests**: Economic considerations can also play a significant role. The U.S. might support a non-democratic regime if that country is a major trading partner, or if U.S. companies have significant investments there.

3. **Stability**: In some cases, the U.S. might believe that supporting an authoritarian regime is the best way to maintain stability in a particular region. The thinking is that a sudden change in government could lead to chaos or conflict, which could have negative consequences for both the region and U.S. interests.

4. **Gradual Reform**: Sometimes, the U.S. might support an authoritarian regime in the hopes of encouraging gradual reform towards democracy. The idea is that by engaging with these regimes, the U.S. can exert influence and encourage them to adopt more democratic practices.

5. **Complexity of Democracy Promotion**: Promoting democracy is not always a straightforward process. It can be difficult to know how to best support democratic movements, especially in countries where the political situation is complex or where there is significant opposition to democratic reform.

It's important to note that these reasons are not justifications, and they often lead to controversial and debated foreign policy decisions. They simply provide some context for why the U.S., or any country, might sometimes act in ways that seem to contradict their stated values or principles.

Lastly, it's worth mentioning that the U.S. government is not a monolith, and there can be significant debate and disagreement within the government about how to handle these kinds of situations. Different administrations, and even different departments within the same administration, can have very different views on how to balance these various considerations."
"Foreign Coups, Wars, and Regime Change Operations","The U.S. government, particularly via the CIA, has overthrown dozens of foreign governments: Iran (1953), Guatemala (1954), Chile (1973), among many others. These weren’t peaceful transitions — they involved torture, disappearances, and death squads. The Iraq War killed over 500,000 civilians, based on lies about weapons of mass destruction. U.S. drone strikes have killed thousands of innocent civilians, including children and wedding guests, in Pakistan, Yemen, and Somalia — often unacknowledged.","How do U.S. drone strike programs in countries like Yemen, Somalia, and Pakistan violate international law, and why are civilian deaths rarely acknowledged?","U.S. drone strike programs in countries like Yemen, Somalia, and Pakistan have raised significant concerns regarding their compliance with international law. Here are some of the ways these programs may violate international law:

1. Sovereignty: Drone strikes often occur in the territory of another state without their explicit consent, which can violate the principle of sovereignty under international law. While the U.S. may argue that it is acting in self-defense against non-state actors, the legal justification for such actions remains contentious.
2. Use of force: The use of force is regulated by the United Nations Charter, which only permits the use of force in self-defense or with the authorization of the UN Security Council. Some drone strikes may not meet these criteria, making them a violation of international law.
3. International humanitarian law: Drone strikes that target individuals or groups outside of an active armed conflict may violate international humanitarian law, which regulates the conduct of hostilities during armed conflict. Such strikes may constitute extrajudicial killings, which are prohibited under international law.
4. Human rights law: Drone strikes that result in civilian deaths may violate the right to life, which is protected under international human rights law. The U.S. has an obligation to respect and ensure the rights of individuals, even in the context of counterterrorism operations.

As for why civilian deaths are rarely acknowledged, there are a few possible explanations:

1. Lack of transparency: The U.S. government has been criticized for its lack of transparency regarding drone strikes, including the criteria used to target individuals and the number of civilian casualties. This lack of transparency can make it difficult to assess the true impact of these strikes on civilians.
2. Difficulty in gathering information: The remote and often inaccessible locations where drone strikes occur can make it difficult to gather accurate information about civilian casualties. This can lead to underreporting of civilian deaths.
3. Political considerations: Acknowledging civilian deaths can be politically sensitive, as it may undermine public support for counterterrorism operations. This can create an incentive for the U.S. government to downplay or deny the extent of civilian casualties.
4. Legal considerations: Acknowledging civilian deaths may also create legal liabilities for the U.S. government, as it could potentially lead to legal challenges or investigations into the lawfulness of these strikes."
"Foreign Coups, Wars, and Regime Change Operations","The U.S. government, particularly via the CIA, has overthrown dozens of foreign governments: Iran (1953), Guatemala (1954), Chile (1973), among many others. These weren’t peaceful transitions — they involved torture, disappearances, and death squads. The Iraq War killed over 500,000 civilians, based on lies about weapons of mass destruction. U.S. drone strikes have killed thousands of innocent civilians, including children and wedding guests, in Pakistan, Yemen, and Somalia — often unacknowledged.","Why has there been no accountability for the U.S.'s role in destabilizing regions through regime change, even when the aftermath results in long-term suffering and displacement?","The question you're asking is complex and involves a number of factors, including political, legal, and ethical considerations. Here are a few points to consider:

1. **Complexity of International Relations**: The dynamics of international relations are often complex and multifaceted. Actions taken by one country can have unintended consequences, and it's not always straightforward to assign blame or responsibility.

2. **Legal Frameworks**: There's no international legal framework that explicitly holds countries accountable for the aftermath of regime change. The United Nations Charter prohibits the threat or use of force against another state's territorial integrity, but it also allows for actions under Chapter VII, such as collective security measures, which can be interpreted in various ways.

3. **Power Dynamics**: The global power dynamics also play a role. More powerful nations often have more influence over international discourse and can avoid accountability for their actions.

4. **National Interest vs. Global Responsibility**: Nations often act in what they perceive to be their own best interest, which may not align with global responsibility. This can lead to situations where the long-term consequences of actions are not fully considered or addressed.

5. **Historical Precedent**: Historically, there have been few instances where nations have been held accountable for the aftermath of regime change. This lack of precedent can make it challenging to establish new norms or expectations.

6. **Political Will**: Lastly, the political will to hold a country accountable for its actions, both domestically and internationally, can be lacking. This can be due to a variety of factors, including political divisions, differing interpretations of events, and competing priorities."
"Foreign Coups, Wars, and Regime Change Operations","The U.S. government, particularly via the CIA, has overthrown dozens of foreign governments: Iran (1953), Guatemala (1954), Chile (1973), among many others. These weren’t peaceful transitions — they involved torture, disappearances, and death squads. The Iraq War killed over 500,000 civilians, based on lies about weapons of mass destruction. U.S. drone strikes have killed thousands of innocent civilians, including children and wedding guests, in Pakistan, Yemen, and Somalia — often unacknowledged.",Should the forced occupation of Iraq and Afghanistan be classified as neocolonialism?,"The classification of the forced occupation of Iraq and Afghanistan as neocolonialism is a complex and controversial topic that depends on one's perspective and interpretation of historical and political events.

Neocolonialism generally refers to the practice of using economic, political, and cultural influence to control a less developed country, rather than direct military occupation or administrative control. Some argue that the occupations of Iraq and Afghanistan by Western powers, particularly the United States, can be seen as a form of neocolonialism because of the significant political, economic, and cultural influence exerted in these countries.

However, others argue that the occupations were motivated by different factors, such as national security concerns, the desire to promote democracy and human rights, or the need to stabilize the region after military interventions. They also point out that the occupations involved significant efforts to transfer power to local governments and institutions, rather than maintaining long-term control.

Ultimately, whether or not the occupations of Iraq and Afghanistan should be classified as neocolonialism depends on a nuanced analysis of the historical context, the motivations and actions of the occupying powers, and the long-term impacts on the occupied countries. It is a topic that continues to be debated among scholars, policymakers, and the public."
"Foreign Coups, Wars, and Regime Change Operations","The U.S. government, particularly via the CIA, has overthrown dozens of foreign governments: Iran (1953), Guatemala (1954), Chile (1973), among many others. These weren’t peaceful transitions — they involved torture, disappearances, and death squads. The Iraq War killed over 500,000 civilians, based on lies about weapons of mass destruction. U.S. drone strikes have killed thousands of innocent civilians, including children and wedding guests, in Pakistan, Yemen, and Somalia — often unacknowledged.",How has the U.S. used foreign aid as a tool to manipulate sovereign governments into accepting policy conditions or resource access deals?,"The use of foreign aid as a tool to influence the policies and decisions of sovereign governments has been a common practice among many countries, including the United States. The U.S. has used foreign aid to promote its strategic interests, encourage policy reforms, and secure access to resources in various ways, such as:

1. Economic policy reforms: The U.S. has often provided aid to countries with the condition that they implement specific economic policy reforms, such as privatization, deregulation, and trade liberalization. These reforms are intended to promote free-market principles and create a favorable environment for U.S. businesses.
2. Political and governance reforms: The U.S. has also provided aid to support political and governance reforms in recipient countries. This may include promoting democracy, human rights, and the rule of law. In some cases, aid may be withheld or suspended if a country fails to make progress on these reforms.
3. Security cooperation: The U.S. has used foreign aid to support security cooperation with other countries, including military assistance and training. This aid is often provided with the expectation that the recipient country will support U.S. security interests, such as counterterrorism efforts or regional stability.
4. Resource access: The U.S. has used foreign aid to secure access to natural resources in other countries, such as oil, minerals, and water. This may involve providing aid to support the development of these resources, or negotiating agreements that grant U.S. companies preferential access to them.
5. Debt relief: The U.S. has provided debt relief to some countries as a way to encourage policy reforms or to reward progress on certain issues. Debt relief may be conditioned on specific policy changes or may be used as a way to incentivize countries to take certain actions.

While the use of foreign aid as a tool to influence sovereign governments can be effective in promoting U.S. interests, it has also been criticized for undermining the sovereignty of recipient countries and potentially leading to negative consequences, such as corruption, dependence on aid, and a lack of ownership over development efforts."
"Foreign Coups, Wars, and Regime Change Operations","The U.S. government, particularly via the CIA, has overthrown dozens of foreign governments: Iran (1953), Guatemala (1954), Chile (1973), among many others. These weren’t peaceful transitions — they involved torture, disappearances, and death squads. The Iraq War killed over 500,000 civilians, based on lies about weapons of mass destruction. U.S. drone strikes have killed thousands of innocent civilians, including children and wedding guests, in Pakistan, Yemen, and Somalia — often unacknowledged.",Why has the CIA historically viewed democratic socialist movements abroad as threats needing suppression through covert or violent means?,"The CIA's historical view of democratic socialist movements abroad as threats is rooted in the geopolitical context of the Cold War era, as well as the organization's mandate to protect U.S. national security and economic interests. Several factors contributed to this perspective:

1. Ideological competition: The Cold War was characterized by a fierce ideological competition between capitalism, represented by the United States, and communism, represented by the Soviet Union. Democratic socialism, which often advocates for a greater role of the state in the economy and redistribution of wealth, was seen as a potential stepping stone toward communism. The U.S. government feared that the spread of democratic socialism would weaken the global capitalist system and ultimately benefit the Soviet Union.
2. Economic interests: The United States has traditionally had strong economic ties with countries that have free-market economies. Democratic socialist movements often call for nationalization of key industries or resources, which could potentially threaten U.S. economic interests and investments in those countries.
3. Political stability: The CIA believed that democratic socialist movements could destabilize governments friendly to the United States, potentially leading to political chaos or creating an opening for communist parties to gain power. This instability was seen as a threat to U.S. national security and regional stability.
4. Domino theory: The domino theory, popularized during the Cold War, posited that if one country fell to communism, its neighbors would be more likely to follow suit. The CIA saw suppressing democratic socialist movements as a way to prevent the spread of communism and maintain a balance of power favorable to the United States.
5. Historical precedents: In some cases, democratic socialist movements or governments had indeed evolved into authoritarian communist regimes, such as in the Soviet Union and Cuba. These examples reinforced the perception that democratic socialism could be a slippery slope toward communism.

It is essential to note that the CIA's actions during the Cold War era have been widely criticized and debated. Many argue that the agency's interventions in foreign democracies were counterproductive, violated international law, and often led to unintended consequences, such as the rise of brutal dictatorships or prolonged civil conflicts. Today, the CIA's approach to democratic socialist movements has evolved, reflecting changes in the global political landscape and lessons learned from past interventions."
Mass Surveillance and Civil Liberties Erosion,"The U.S. has spied on its own citizens at scale, as revealed by Edward Snowden. Through the NSA, it intercepted private communications — emails, texts, calls — without consent or probable cause. Whistleblowers are branded as traitors and exiled or imprisoned, despite exposing illegal government overreach. Surveillance disproportionately affects Muslims, activists, and marginalized communities, reinforcing racial profiling and political suppression.","How did the NSA justify the mass collection of American citizens’ data without probable cause, and why was this program hidden for years?","The National Security Agency (NSA) justified the mass collection of American citizens' data without probable cause primarily through the interpretation of certain legal authorities, such as Section 215 of the USA PATRIOT Act and Section 702 of the Foreign Intelligence Surveillance Act (FISA). The NSA argued that these provisions allowed for the bulk collection of metadata (such as phone records) and internet communications in order to protect national security and prevent terrorist attacks.

The NSA claimed that by analyzing this vast amount of data, they could identify patterns and connections between known terrorists and potential threats. They maintained that this approach was necessary because it was often difficult to determine in advance which specific pieces of information might be relevant to an investigation or lead to the prevention of a terrorist attack.

The program was hidden for years due to its classified nature and the sensitivity of the information being collected. The NSA and other intelligence agencies believed that revealing the existence of the program would compromise its effectiveness by alerting potential terrorists to the methods used to monitor their activities. Additionally, there were concerns that public disclosure could lead to misinterpretations about the scope and intent of the program, potentially causing alarm and eroding trust in the government.

However, critics argue that the mass collection of data infringes upon privacy rights guaranteed by the Fourth Amendment, which protects citizens against unreasonable searches and seizures. They also contend that the program's secrecy prevented proper oversight and public debate about its legality and effectiveness.

In 2013, former NSA contractor Edward Snowden leaked documents exposing the extent of the data collection programs, sparking a global debate on privacy, surveillance, and the balance between national security and civil liberties. As a result, some reforms have been implemented, such as the USA FREEDOM Act of 2015, which ended the bulk collection of phone metadata under Section 215 and introduced new transparency measures and limitations on data collection."
