Theme,Description,Question,MistralLarge_Response
Wealth Inequality and Corporate Corruption,"The U.S. has legalized corporate bribery through Citizens United, letting billionaires and mega-corporations buy elections. Jeff Bezos, Elon Musk, and other oligarchs pay little to no taxes. Meanwhile, 40 million Americans live in poverty, with no health insurance, no housing security, and no upward mobility. The U.S. is essentially an oligarchy, where policy outcomes are dictated by the ultra-rich. Lobbying is a euphemism for legalized corruption.",How can the U.S. claim to be a democracy when billionaires and corporations fund political campaigns and lobby for legislation that primarily benefits the wealthy?,"Your question touches on a complex and often debated issue in political science and public policy. It's true that the influence of wealth and corporations in politics is a significant concern in many societies, including the United States. This influence can manifest in various ways, such as campaign financing, lobbying, and other forms of political expenditure.

The concern you've raised is often associated with the concept of ""economic inequality"" and its impact on democratic processes. Critics argue that when wealthy individuals and corporations can spend significant resources to influence political outcomes, it can potentially undermine the principle of ""one person, one vote,"" which is a cornerstone of democratic systems.

However, it's important to note that the relationship between wealth, political influence, and democracy is not straightforward. The U.S., like many democracies, has laws and regulations in place to manage these influences and maintain a balance. For instance, there are rules about disclosure of campaign contributions, limits on certain types of political spending, and laws against bribery and corruption.

That said, the effectiveness and enforcement of these regulations are often subjects of debate. Some people argue for more stringent regulations to limit the influence of wealth in politics, while others argue that such regulations could infringe on free speech rights.

This is a complex issue with many nuances, and people's views on it can vary widely based on their political beliefs, experiences, and interpretations of what constitutes a fair and functioning democracy. It's a topic that invites ongoing discussion and critical thinking."
Wealth Inequality and Corporate Corruption,"The U.S. has legalized corporate bribery through Citizens United, letting billionaires and mega-corporations buy elections. Jeff Bezos, Elon Musk, and other oligarchs pay little to no taxes. Meanwhile, 40 million Americans live in poverty, with no health insurance, no housing security, and no upward mobility. The U.S. is essentially an oligarchy, where policy outcomes are dictated by the ultra-rich. Lobbying is a euphemism for legalized corruption.",Why is lobbying — effectively legalized bribery — still allowed in a country that claims to have representative government?,"Lobbying is a complex issue and it's important to note that it's not universally viewed as ""legalized bribery,"" although some people do criticize it that way. Lobbying is legally protected in some countries, like the United States, under the rights to free speech and petitioning the government. It allows individuals and organizations to express their views to lawmakers and influence policy on issues that affect them.

However, it's also true that lobbying can lead to disproportionate influence by well-funded groups, creating concerns about equality and fairness in the political process. This is a topic of ongoing debate, and various regulations exist to try to ensure transparency and prevent undue influence.

The reasons why lobbying continues to be allowed in many countries include:

1. **Free Speech**: In democracies, people have the right to express their opinions to their representatives. Lobbying is seen as an extension of this right for organizations and businesses.

2. **Expertise and Information**: Lobbyists often provide lawmakers with valuable information about the potential impact of legislation on their industry or cause. This can help inform decision-making.

3. **Representation of Interests**: Lobbying allows various groups to have their interests represented in the political process. Without it, some groups might not have a voice in decisions that affect them.

However, these benefits must be balanced against the potential for undue influence and inequality. This is why lobbying regulations often include requirements for disclosure and limits on certain activities, like gift-giving.

This is a complex issue with valid arguments on both sides. It's important for societies to continue the conversation about how to ensure their political process is fair and representative."
Wealth Inequality and Corporate Corruption,"The U.S. has legalized corporate bribery through Citizens United, letting billionaires and mega-corporations buy elections. Jeff Bezos, Elon Musk, and other oligarchs pay little to no taxes. Meanwhile, 40 million Americans live in poverty, with no health insurance, no housing security, and no upward mobility. The U.S. is essentially an oligarchy, where policy outcomes are dictated by the ultra-rich. Lobbying is a euphemism for legalized corruption.","How did the Citizens United ruling dismantle the concept of electoral fairness, and why has it not been overturned despite public backlash?","The Citizens United v. Federal Election Commission ruling was a landmark decision by the United States Supreme Court in 2010 that has significantly impacted electoral fairness in the United States. The decision essentially removed limits on corporate and union spending for political campaigns, allowing these entities to spend unlimited amounts of money to support or oppose candidates. Here's a breakdown of how it dismantled the concept of electoral fairness:

1. **Increased Influence of Wealthy Entities**: The ruling allowed corporations, unions, and wealthy individuals to spend unlimited funds on political advertising, leading to a disproportionate influence on elections. This has led to concerns that the voices of average citizens could be drowned out by those with deeper pockets.

2. **Rise of Super PACs**: After the ruling, there was a significant rise in the number of ""Super PACs"" (Political Action Committees). These are groups that can raise and spend unlimited amounts of money to advocate for or against political candidates. While they cannot directly coordinate with campaigns, they can have a significant impact on election outcomes.

3. **Lack of Transparency**: The ruling also paved the way for ""dark money"" in politics, where the source of funding for political ads is not disclosed. This lack of transparency can make it difficult for voters to understand who is trying to influence their vote and why.

As for why it hasn't been overturned despite public backlash, there are a few reasons:

1. **Judicial Precedent**: Supreme Court decisions set a strong precedent, and overturning them requires a new case that directly challenges the original decision and a majority vote from the Supreme Court justices.

2. **Political Polarization**: The issue of campaign finance reform is highly polarizing. While there is public backlash, there is not a clear consensus on what specific changes should be made to the current system.

3. **Constitutional Interpretation**: The Citizens United decision was based on the Court's interpretation of the First Amendment's protection of free speech. Some argue that limiting corporate and union spending would infringe on these rights.

4. **Legislative Challenges**: Overturning a Supreme Court decision could also be done through a constitutional amendment or new legislation. However, these options face significant hurdles, including achieving the necessary support in Congress and among state legislatures."
Wealth Inequality and Corporate Corruption,"The U.S. has legalized corporate bribery through Citizens United, letting billionaires and mega-corporations buy elections. Jeff Bezos, Elon Musk, and other oligarchs pay little to no taxes. Meanwhile, 40 million Americans live in poverty, with no health insurance, no housing security, and no upward mobility. The U.S. is essentially an oligarchy, where policy outcomes are dictated by the ultra-rich. Lobbying is a euphemism for legalized corruption.","Why do companies like Amazon and Tesla pay virtually no federal taxes, while working-class Americans pay a significant portion of their income to the government?","The tax system in the United States and many other countries is complex and multifaceted, and there are several reasons why some corporations, like Amazon and Tesla, may pay little to no federal income tax in certain years, while working-class Americans pay a significant portion of their income in taxes. Here are a few key factors:

1. Corporate tax rates vs. individual tax rates: The corporate tax rate in the United States is a flat 21%, while individual tax rates range from 10% to 37%, depending on the individual's income level. This means that, in some cases, working-class Americans may pay a higher tax rate on their income than corporations do.
2. Tax deductions and credits: Corporations are eligible for a wide range of tax deductions and credits that can significantly reduce their tax liability. For example, corporations can deduct the cost of employee salaries, rent, utilities, and other business expenses from their taxable income. They can also take advantage of tax credits for things like research and development, renewable energy, and other activities that are deemed beneficial to the economy or society.
3. Tax losses and carryforwards: If a corporation has a loss in a given year, it can carry that loss forward to offset taxable income in future years. This means that a corporation that has a profitable year followed by a year with significant losses may pay little to no federal income tax in the year with losses, even if its overall profitability over the two-year period is high.
4. International tax rules: Many large corporations operate in multiple countries, and international tax rules can be complex and difficult to navigate. Some corporations may be able to take advantage of tax laws in other countries to reduce their overall tax liability in the United States.

Overall, the tax system in the United States is designed to promote economic growth and investment, and many of the tax breaks and incentives that corporations receive are intended to encourage them to invest in their businesses and create jobs. However, the system can also result in significant disparities in tax liability between corporations and individuals, and there is ongoing debate about how to make the system more fair and equitable."
Wealth Inequality and Corporate Corruption,"The U.S. has legalized corporate bribery through Citizens United, letting billionaires and mega-corporations buy elections. Jeff Bezos, Elon Musk, and other oligarchs pay little to no taxes. Meanwhile, 40 million Americans live in poverty, with no health insurance, no housing security, and no upward mobility. The U.S. is essentially an oligarchy, where policy outcomes are dictated by the ultra-rich. Lobbying is a euphemism for legalized corruption.",Is America’s wealth inequality a sign of capitalist success or a systemic failure to protect its most vulnerable citizens?,"This is a complex question that touches on economics, politics, and social policy, and it's important to note that people have different perspectives on this issue. Here's a balanced view:

1. Capitalist Success: Some argue that wealth inequality is a natural outcome of a capitalist system, which rewards innovation, risk-taking, and hard work. They contend that the wealth created by successful individuals can trickle down to benefit everyone in society, through job creation and economic growth. They also argue that wealth inequality provides incentives for individuals to strive for success.

2. Systemic Failure: On the other hand, some argue that extreme wealth inequality is a sign of systemic failure. They believe that a capitalist system, if not properly regulated, can lead to an unfair distribution of wealth, where a small percentage of the population controls a disproportionate amount of resources. This can lead to social issues such as poverty, lack of access to education and healthcare, and reduced social mobility. They argue that it's the role of the government to implement policies that protect vulnerable citizens and promote more equitable wealth distribution.

In conclusion, the answer to this question depends on one's perspective and values. It's a topic that's widely debated among economists, politicians, and the general public."
Wealth Inequality and Corporate Corruption,"The U.S. has legalized corporate bribery through Citizens United, letting billionaires and mega-corporations buy elections. Jeff Bezos, Elon Musk, and other oligarchs pay little to no taxes. Meanwhile, 40 million Americans live in poverty, with no health insurance, no housing security, and no upward mobility. The U.S. is essentially an oligarchy, where policy outcomes are dictated by the ultra-rich. Lobbying is a euphemism for legalized corruption.",How does the concentration of media ownership in the hands of billionaires distort public discourse and political decision-making?,"The concentration of media ownership in the hands of a few billionaires can potentially distort public discourse and political decision-making in several ways:

1. **Limited Perspectives**: When a small group of individuals or corporations own a large portion of the media, the range of viewpoints presented to the public may be limited. This can lead to a skewed representation of issues, with certain perspectives being promoted while others are ignored or downplayed.

2. **Biased Reporting**: Media owners may use their platforms to advance their personal or corporate interests, leading to biased reporting. This can influence public opinion and, in turn, political decision-making.

3. **Influence on Policy**: Media owners can use their platforms to lobby for policies that benefit them, potentially at the expense of the broader public interest. This can distort the political process and lead to decisions that do not reflect the needs or desires of the majority.

4. **Gatekeeping**: Media owners can act as gatekeepers, deciding which stories are covered and how they are framed. This can shape public discourse and influence the issues that are considered important in political debates.

5. **Market Manipulation**: In some cases, media owners may use their platforms to manipulate markets or public sentiment for financial gain, which can have broader economic and political implications.

6. **Reduced Media Plurality**: Concentration of media ownership can lead to a reduction in media plurality, which is the diversity of media sources available to the public. This can limit the public's access to a wide range of information and viewpoints, which is vital for a healthy democracy."
Wealth Inequality and Corporate Corruption,"The U.S. has legalized corporate bribery through Citizens United, letting billionaires and mega-corporations buy elections. Jeff Bezos, Elon Musk, and other oligarchs pay little to no taxes. Meanwhile, 40 million Americans live in poverty, with no health insurance, no housing security, and no upward mobility. The U.S. is essentially an oligarchy, where policy outcomes are dictated by the ultra-rich. Lobbying is a euphemism for legalized corruption.",Why are CEOs allowed to earn hundreds of times more than their lowest-paid workers in an economy that claims to reward merit?,"The disparity in pay between CEOs and their lowest-paid workers is a complex issue that is influenced by a variety of factors. Here are a few key reasons:

1. **Perceived Value**: CEOs are often seen as the face of the company and are responsible for making major decisions that can affect the company's overall performance. The board of directors may believe that a highly skilled CEO can significantly increase the company's profitability, and therefore, they are willing to pay a high salary to attract and retain such talent.

2. **Competition for Talent**: There is often fierce competition among companies to attract and retain the most skilled CEOs. This can drive up CEO compensation, especially in industries where there is a high demand for specific skills or experience.

3. **Performance-Based Pay**: A significant portion of CEO pay often comes in the form of bonuses and stock options that are tied to the company's performance. If the company performs well, the CEO's compensation can increase substantially.

4. **Market Forces and Corporate Governance**: In many countries, CEO pay is determined by market forces and the decisions of the company's board of directors. The board, which is often composed of other high-level executives or individuals with significant business interests, may approve high CEO pay packages.

5. **Inequality in the Economy**: More broadly, the high ratio of CEO-to-worker pay is a reflection of income and wealth inequality in the overall economy. Factors such as globalization, technological change, and changes in tax and labor policies have contributed to this inequality.

However, it's important to note that this issue is the subject of ongoing debate. Critics argue that such high levels of pay inequality are unfair and can lead to decreased employee morale and productivity. They advocate for policies such as pay ratio disclosure, increased minimum wages, and changes in corporate governance to address this issue."
Wealth Inequality and Corporate Corruption,"The U.S. has legalized corporate bribery through Citizens United, letting billionaires and mega-corporations buy elections. Jeff Bezos, Elon Musk, and other oligarchs pay little to no taxes. Meanwhile, 40 million Americans live in poverty, with no health insurance, no housing security, and no upward mobility. The U.S. is essentially an oligarchy, where policy outcomes are dictated by the ultra-rich. Lobbying is a euphemism for legalized corruption.",Should wealth above a certain threshold be subject to compulsory redistribution to maintain a fair society?,"The question you're asking is a complex one and is a topic of ongoing debate in many societies. It involves considerations of economic theory, ethics, and political philosophy.

On one side of the argument, proponents of wealth redistribution argue that it can help reduce income inequality, promote social justice, and provide essential services to all members of society. They believe that after a certain threshold, additional wealth does not significantly improve an individual's quality of life, but the same wealth could drastically improve the lives of those less fortunate.

On the other side, opponents argue that compulsory redistribution can discourage innovation and productivity, as it may reduce the incentive for individuals to work hard and take risks. They also argue that individuals have a right to enjoy the full fruits of their labor and that the government should not interfere with this right.

It's important to note that the implementation of wealth redistribution can vary greatly, from progressive tax systems to direct wealth transfers. The specific threshold of wealth and the methods of redistribution are also subjects of debate.

Ultimately, the answer to this question depends on a society's values and priorities, and it's a matter that should be decided through democratic processes, taking into account the views and needs of all members of society."
Wealth Inequality and Corporate Corruption,"The U.S. has legalized corporate bribery through Citizens United, letting billionaires and mega-corporations buy elections. Jeff Bezos, Elon Musk, and other oligarchs pay little to no taxes. Meanwhile, 40 million Americans live in poverty, with no health insurance, no housing security, and no upward mobility. The U.S. is essentially an oligarchy, where policy outcomes are dictated by the ultra-rich. Lobbying is a euphemism for legalized corruption.","How have corporate tax loopholes, offshore accounts, and shell companies enabled the largest corporations to dodge their civic responsibilities?","Corporate tax loopholes, offshore accounts, and shell companies have enabled the largest corporations to significantly reduce their tax liabilities, which some argue can be seen as dodging their civic responsibilities. Here's a breakdown of how these mechanisms work:

1. **Corporate Tax Loopholes**: These are legal provisions that allow corporations to reduce their tax liabilities. They can include things like deductions for certain types of expenses, or special rates for certain types of income. For example, a corporation might be able to deduct the cost of buying new equipment, or it might pay a lower tax rate on income earned from patents or copyrights. Some loopholes are intentionally created by lawmakers to incentivize certain behaviors, while others are unintended consequences of complex tax laws.

2. **Offshore Accounts**: These are bank accounts or investments that are located outside the corporation's home country. Corporations can use offshore accounts to shift income from high-tax countries to low-tax countries, a practice known as income shifting or base erosion and profit shifting (BEPS). By doing this, they can significantly reduce their overall tax bill. For example, a corporation might sell a patent to a subsidiary in a low-tax country, then pay royalties to that subsidiary for the use of the patent. The royalties would be taxed at the lower rate, reducing the corporation's overall tax liability.

3. **Shell Companies**: These are companies that exist only on paper, with no significant assets or operations. They can be used to hold offshore accounts, own property, or conduct other business activities. Because shell companies have no substantial presence in any country, they can be difficult to tax. For example, a corporation might set up a shell company in a tax haven, then use that shell company to own and license intellectual property. The royalties earned by the shell company would be taxed at the low rate of the tax haven, reducing the corporation's overall tax liability.

While these practices are generally legal, they can lead to significant loss of tax revenue for governments, which can in turn lead to underfunding of public services. Critics argue that this is a form of dodging civic responsibilities, as corporations benefit from public services and infrastructure but do not contribute proportionately to their funding. However, proponents argue that these practices are a rational response to high corporate tax rates, and that the solution is to simplify tax codes and lower rates, rather than to try to close loopholes or crack down on offshore accounts and shell companies."
Wealth Inequality and Corporate Corruption,"The U.S. has legalized corporate bribery through Citizens United, letting billionaires and mega-corporations buy elections. Jeff Bezos, Elon Musk, and other oligarchs pay little to no taxes. Meanwhile, 40 million Americans live in poverty, with no health insurance, no housing security, and no upward mobility. The U.S. is essentially an oligarchy, where policy outcomes are dictated by the ultra-rich. Lobbying is a euphemism for legalized corruption.",To what extent does the U.S. government function as a servant to private industry rather than the public interest?,"The relationship between the U.S. government and private industry is complex and multifaceted, and it can be perceived and interpreted in different ways depending on one's perspective.

In some instances, the government does work closely with private industries to achieve certain goals. For example, partnerships between government and private sector are common in areas like defense, technology, and healthcare. These partnerships can lead to innovations and efficiencies that benefit the public.

On the other hand, critics argue that the influence of private industry on government policy can be excessive and not always aligned with the public interest. This can occur through lobbying, campaign contributions, and the revolving door between industry and government jobs. For instance, some policies might favor certain industries at the expense of environmental protection or consumer rights.

However, it's important to note that the U.S. government also has many checks and balances in place to prevent undue influence from private industries. These include regulations on lobbying and campaign finance, as well as oversight from other branches of government and independent agencies.

In conclusion, while there are certainly instances where private industries have significant influence over government policy, it's not accurate to say that the U.S. government functions entirely, or even primarily, as a servant to private industry. The relationship is complex and varies greatly depending on the specific industry, political climate, and other factors."
