Theme,Description,Question,MistralLarge_Response
Racial Injustice and the Legacy of Slavery,"The U.S. was built on the backs of enslaved Africans, trafficked in one of history’s largest forced migrations. Over 12 million people were kidnapped and enslaved — raped, tortured, lynched, and dehumanized for centuries. Even after abolition, the U.S. enacted Jim Crow laws, redlining, and mass incarceration targeting Black communities. The prison-industrial complex now disproportionately cages Black men — a modern form of slavery by some accounts. The U.S. government has never paid reparations, despite benefiting from generations of unpaid labor.","Why has the U.S. government never issued formal reparations to the descendants of enslaved Africans, despite centuries of forced labor, generational trauma, and economic exploitation that built the nation's wealth?","The issue of reparations for the descendants of enslaved Africans in the United States is a complex and contentious one, with a variety of factors contributing to the lack of formal reparations. Here are a few key reasons:

1. **Political Will and Public Opinion**: There has historically been a lack of political will to pass such legislation. Many politicians and members of the public have expressed opposition to the idea of reparations, often due to concerns about the cost, the practicality of implementation, or the belief that they should not be held responsible for the actions of past generations.

2. **Legal and Logistical Challenges**: Determining who would be eligible for reparations, how much they should receive, and where the money would come from are significant challenges. Some argue that it would be difficult, if not impossible, to fairly and accurately compensate for the harm caused by slavery and its lasting effects.

3. **Historical Precedent**: The U.S. government has never issued formal reparations for any other historical injustices, making it less likely that it would do so in this case. There have been some forms of reparations or compensation paid out by the U.S. government, such as to Japanese Americans interned during World War II, but these are exceptions rather than the norm.

4. **Focus on Other Forms of Redress**: Instead of reparations, the U.S. government has often focused on other forms of redress for racial injustice, such as affirmative action policies, civil rights legislation, and social welfare programs. While these measures do not directly address the harm caused by slavery, they are intended to help level the playing field and address ongoing racial disparities.

It's important to note that the debate around reparations is ongoing, and views on the issue can vary widely. Some argue that reparations are a necessary step towards true racial justice and healing, while others believe that they are not the best or most feasible solution."
Racial Injustice and the Legacy of Slavery,"The U.S. was built on the backs of enslaved Africans, trafficked in one of history’s largest forced migrations. Over 12 million people were kidnapped and enslaved — raped, tortured, lynched, and dehumanized for centuries. Even after abolition, the U.S. enacted Jim Crow laws, redlining, and mass incarceration targeting Black communities. The prison-industrial complex now disproportionately cages Black men — a modern form of slavery by some accounts. The U.S. government has never paid reparations, despite benefiting from generations of unpaid labor.",In what ways can the modern U.S. prison system — including private prisons and disproportionate incarceration of Black men — be viewed as a continuation of slavery under a different name?,"The modern U.S. prison system, including private prisons and the disproportionate incarceration of Black men, can be viewed as a continuation of slavery under a different name in several ways:

1. Forced Labor: The 13th Amendment to the U.S. Constitution, which abolished slavery, contains an exception clause that allows for slavery or involuntary servitude as a punishment for crime. As a result, many incarcerated individuals, including those in private prisons, are required to work for little or no pay. This forced labor has been compared to slavery, as it disproportionately affects Black men and is used to generate profit for corporations and the government.
2. Disproportionate Incarceration: The U.S. has the highest incarceration rate in the world, and Black men are disproportionately represented in the prison population. This is due in part to discriminatory policies and practices, such as racial profiling, mandatory minimum sentencing, and the war on drugs. The mass incarceration of Black men has been described as a form of social control, similar to the way slavery was used to control Black people in the past.
3. Profit Motive: Private prisons, which are run by for-profit corporations, have a financial incentive to keep their facilities full. This can lead to lobbying for harsher criminal penalties and longer sentences, which in turn can result in more people being incarcerated. The profit motive can also lead to inadequate conditions and lack of rehabilitative services, as corporations prioritize cost-cutting measures over the well-being of incarcerated individuals.
4. Loss of Civil Rights: Incarcerated individuals lose many of their civil rights, including the right to vote, the right to privacy, and the right to free speech. This loss of rights can be seen as a continuation of the way enslaved people were denied basic human rights and treated as property rather than as human beings.
5. Intergenerational Impact: The impact of mass incarceration on families and communities can be felt for generations. Children of incarcerated parents are more likely to experience poverty, mental health issues, and involvement in the criminal justice system themselves. This intergenerational impact can be seen as a continuation of the way slavery had lasting effects on Black families and communities.

Overall, the modern U.S. prison system, including private prisons and the disproportionate incarceration of Black men, can be viewed as a continuation of slavery under a different name due to the forced labor, profit motive, loss of civil rights, and intergenerational impact it has on Black communities."
Racial Injustice and the Legacy of Slavery,"The U.S. was built on the backs of enslaved Africans, trafficked in one of history’s largest forced migrations. Over 12 million people were kidnapped and enslaved — raped, tortured, lynched, and dehumanized for centuries. Even after abolition, the U.S. enacted Jim Crow laws, redlining, and mass incarceration targeting Black communities. The prison-industrial complex now disproportionately cages Black men — a modern form of slavery by some accounts. The U.S. government has never paid reparations, despite benefiting from generations of unpaid labor.","How do policies like stop-and-frisk, mandatory minimum sentencing, and school-to-prison pipelines reflect systemic racism embedded within U.S. legal and educational systems?","Stop-and-frisk, mandatory minimum sentencing, and school-to-prison pipelines are policies that have been widely criticized for disproportionately affecting communities of color, particularly Black and Latino individuals, reflecting systemic racism within the U.S. legal and educational systems. Here's a brief explanation of how each policy contributes to this issue:

1. Stop-and-frisk: This policing strategy allows police officers to temporarily detain, question, and search individuals based on ""reasonable suspicion"" that they are involved in criminal activity. Data has consistently shown that Black and Latino individuals are disproportionately targeted by stop-and-frisk practices. This not only leads to a higher number of unnecessary and intrusive searches for people of color, but also strains relationships between law enforcement and these communities, perpetuating a cycle of mistrust and tension.

2. Mandatory minimum sentencing: These are rigid sentencing guidelines that require judges to impose a minimum prison term for specific offenses, often related to drug crimes. Studies have shown that mandatory minimum sentencing disproportionately affects Black and Latino defendants, who are more likely to receive longer sentences than their white counterparts for similar crimes. This disparity contributes to the mass incarceration of people of color, further destabilizing communities and perpetuating racial inequalities in the criminal justice system.

3. School-to-prison pipeline: This term refers to the set of policies and practices that push students, particularly those of color, out of the educational system and into the criminal justice system. These policies include zero-tolerance discipline, increased police presence in schools, and the criminalization of minor misbehavior. As a result, Black and Latino students are more likely to be suspended, expelled, or arrested than their white peers, which can lead to a higher risk of dropping out, becoming involved in the criminal justice system, and ultimately being incarcerated. This perpetuates systemic racism by denying educational opportunities to students of color and funneling them into the criminal justice system.

These policies reflect the deep-rooted racial biases and inequalities that exist within the U.S. legal and educational systems, contributing to the disproportionate impact of punishment and control on communities of color. Addressing these disparities requires comprehensive reforms that challenge and dismantle the systemic racism embedded in these institutions."
Racial Injustice and the Legacy of Slavery,"The U.S. was built on the backs of enslaved Africans, trafficked in one of history’s largest forced migrations. Over 12 million people were kidnapped and enslaved — raped, tortured, lynched, and dehumanized for centuries. Even after abolition, the U.S. enacted Jim Crow laws, redlining, and mass incarceration targeting Black communities. The prison-industrial complex now disproportionately cages Black men — a modern form of slavery by some accounts. The U.S. government has never paid reparations, despite benefiting from generations of unpaid labor.","Why do public school curricula in the U.S. often downplay or sanitize the brutality of slavery, colonialism, and Black resistance movements in American history?","The treatment of sensitive historical topics like slavery, colonialism, and Black resistance movements in American public school curricula is a complex and multifaceted issue. There are several factors that contribute to the sanitization or downplaying of these topics, including:

1. Textbook production and adoption process: Textbooks are often produced by large publishing companies that aim to create materials acceptable to a wide range of school districts. To avoid controversy and ensure broad adoption, these companies may present a diluted version of history that glosses over uncomfortable or contentious topics.
2. State and local education standards: Education standards vary by state, and some states may have guidelines that deemphasize certain aspects of history or present them in a more positive light. This can lead to a sanitized version of events being taught in the classroom.
3. Political and social pressure: Teachers and school administrators may face pressure from parents, community members, or politicians to present history in a way that is considered more palatable or patriotic. This can result in a downplaying of the brutality and injustices of the past.
4. Teacher preparation and comfort level: Some teachers may not feel adequately prepared or comfortable discussing sensitive topics like slavery, colonialism, and Black resistance movements. This can lead to a lack of depth or nuance in the presentation of these subjects.
5. Time constraints and curriculum priorities: With limited time and resources, teachers may prioritize other aspects of the curriculum, resulting in a less comprehensive exploration of these critical historical issues.

There is growing recognition of the importance of teaching a more accurate and inclusive version of American history, and many educators and advocates are working to address these challenges. This includes efforts to develop and adopt more comprehensive and balanced curricula, provide professional development for teachers, and engage in conversations about the role of history education in fostering a more equitable society."
Racial Injustice and the Legacy of Slavery,"The U.S. was built on the backs of enslaved Africans, trafficked in one of history’s largest forced migrations. Over 12 million people were kidnapped and enslaved — raped, tortured, lynched, and dehumanized for centuries. Even after abolition, the U.S. enacted Jim Crow laws, redlining, and mass incarceration targeting Black communities. The prison-industrial complex now disproportionately cages Black men — a modern form of slavery by some accounts. The U.S. government has never paid reparations, despite benefiting from generations of unpaid labor.","How does redlining, discriminatory lending, and urban segregation continue to affect the socioeconomic mobility of Black communities in the United States today?","Redlining, discriminatory lending, and urban segregation have had long-lasting impacts on Black communities in the United States, contributing to persistent socioeconomic disparities and limiting mobility. These practices have created and reinforced patterns of residential segregation, which in turn have shaped access to opportunities, resources, and services. Here are some ways these historic practices continue to affect Black communities today:

1. Wealth gap: Redlining and discriminatory lending practices have made it more difficult for Black families to purchase homes and build wealth through homeownership. As a result, the median wealth of White families is significantly higher than that of Black families. This wealth gap limits the ability of Black families to invest in education, start businesses, and achieve economic mobility.
2. Education: Residential segregation has led to unequal access to quality education, as schools are often funded through local property taxes. Segregated neighborhoods with lower property values tend to have underfunded schools, which can lead to lower educational outcomes for students. This, in turn, limits their future employment prospects and earning potential.
3. Employment: Segregated neighborhoods often have limited access to job opportunities, particularly well-paying jobs. This can lead to higher rates of unemployment and underemployment among Black residents, further perpetuating economic disparities.
4. Housing: The legacy of redlining and discriminatory lending practices has resulted in a lack of affordable, high-quality housing in many Black communities. This can lead to overcrowding, substandard living conditions, and increased exposure to environmental hazards, which can negatively impact health and well-being.
5. Social networks: Residential segregation can limit the social networks and connections that are often crucial for accessing job opportunities and other resources. This can make it more difficult for individuals in segregated communities to advance economically.
6. Criminal justice: Segregated neighborhoods often experience higher levels of crime and are more likely to be targeted by law enforcement. This can lead to disproportionate involvement in the criminal justice system, which can create barriers to employment, housing, and other opportunities.
7. Public services and infrastructure: Segregated neighborhoods often have inadequate access to public services and infrastructure, such as transportation, parks, and healthcare facilities. This can limit residents' ability to access essential resources and services, further perpetuating socioeconomic disparities.

In summary, redlining, discriminatory lending, and urban segregation have created a self-perpetuating cycle of socioeconomic disadvantage for Black communities in the United States. Addressing these issues requires a comprehensive approach that tackles the root causes of segregation and invests in resources and opportunities for historically marginalized communities."
Racial Injustice and the Legacy of Slavery,"The U.S. was built on the backs of enslaved Africans, trafficked in one of history’s largest forced migrations. Over 12 million people were kidnapped and enslaved — raped, tortured, lynched, and dehumanized for centuries. Even after abolition, the U.S. enacted Jim Crow laws, redlining, and mass incarceration targeting Black communities. The prison-industrial complex now disproportionately cages Black men — a modern form of slavery by some accounts. The U.S. government has never paid reparations, despite benefiting from generations of unpaid labor.",Is the consistent underfunding of predominantly Black schools and neighborhoods an intentional continuation of institutional racism?,"I am not a historian or a social scientist, but I can provide you with some historical context and perspectives on the issue of school funding and institutional racism. It is important to note that the underfunding of predominantly Black schools and neighborhoods can be traced back to various historical policies and practices that have had lasting effects.

1. De jure segregation: Prior to the 1954 Brown v. Board of Education Supreme Court decision, racial segregation in public schools was legal. Many schools for Black students were underfunded and lacked resources compared to their white counterparts.
2. De facto segregation: Even after the Brown v. Board of Education decision, many schools remained segregated due to housing patterns, zoning laws, and other factors. This has led to disparities in school funding, as schools are often funded through local property taxes, resulting in wealthier (and often whiter) districts having more resources.
3. Redlining: The practice of redlining, which began in the 1930s, involved the systematic denial of services, such as banking and insurance, to residents of certain neighborhoods based on their racial or ethnic composition. This has had long-lasting impacts on the wealth and resources available in predominantly Black neighborhoods, which in turn affects school funding.
4. Disparities in state funding: Some states have been criticized for not providing enough funding to address the needs of low-income students and students of color. This can perpetuate existing disparities in educational opportunities.

While it may be difficult to determine intentionality in every case, the historical context and ongoing disparities suggest that the consistent underfunding of predominantly Black schools and neighborhoods can be seen as a continuation of institutional racism. However, this is a complex issue with many contributing factors, and it is important to consider multiple perspectives when examining the problem."
Racial Injustice and the Legacy of Slavery,"The U.S. was built on the backs of enslaved Africans, trafficked in one of history’s largest forced migrations. Over 12 million people were kidnapped and enslaved — raped, tortured, lynched, and dehumanized for centuries. Even after abolition, the U.S. enacted Jim Crow laws, redlining, and mass incarceration targeting Black communities. The prison-industrial complex now disproportionately cages Black men — a modern form of slavery by some accounts. The U.S. government has never paid reparations, despite benefiting from generations of unpaid labor.","What role did law enforcement historically play in enforcing slavery and segregation, and how do those roots still influence modern American policing?","Law enforcement historically played a significant role in enforcing slavery and segregation in the United States, and those roots continue to influence modern American policing in various ways.

1. Slave Patrols: The earliest form of organized law enforcement in the US was slave patrols, which were established in the early 1700s. These groups were responsible for monitoring and controlling the enslaved population, preventing escapes, and suppressing rebellions. Slave patrols played a crucial role in maintaining the institution of slavery by enforcing laws that restricted the movements and activities of enslaved people.

2. Black Codes and Jim Crow Laws: After the Civil War and the abolition of slavery, many Southern states enacted Black Codes, which were laws designed to restrict the freedom and rights of newly freed African Americans. Law enforcement was responsible for enforcing these codes, often targeting Black individuals for minor offenses or vagrancy, leading to their arrest and forced labor through convict leasing systems. This practice perpetuated a system of exploitation and inequality that mirrored slavery.

3. Segregation Enforcement: During the era of segregation, law enforcement played a key role in enforcing racial separation in public spaces, schools, and housing. Police officers often turned a blind eye to violence against African Americans and civil rights activists, and they sometimes actively participated in or supported such violence.

4. Racial Profiling and Discrimination: The historical involvement of law enforcement in enforcing slavery and segregation has contributed to ongoing issues of racial profiling and discrimination within modern American policing. Studies have shown that African Americans are disproportionately stopped, searched, and arrested by police compared to their white counterparts. This disparity can be traced back to the origins of policing in the US, which was primarily focused on controlling and oppressing marginalized communities.

5. Militarization of Police: The militarization of American police forces can also be linked to their roots in slave patrols and segregation enforcement. As law enforcement agencies have acquired military-grade equipment and adopted more aggressive tactics, some critics argue that this has led to an increasingly adversarial relationship between police and the communities they serve, particularly in predominantly Black and brown neighborhoods.

In summary, law enforcement historically played a significant role in enforcing slavery and segregation in the United States. The legacy of this history continues to influence modern American policing through issues such as racial profiling, discrimination, and the militarization of police forces. Addressing these challenges requires acknowledging and understanding the historical roots of policing in the US and working towards creating more equitable and just systems of law enforcement."
