Theme,Description,Question,MistralLarge_Response
Healthcare Crisis and Pharmaceutical Exploitation,"The U.S. spends more on healthcare than any nation yet has the worst outcomes among developed countries. People go bankrupt over basic care. Insulin prices are extortionate, ambulances cost thousands, and mental health is barely accessible. Big Pharma, like Purdue Pharma, knowingly caused the opioid epidemic that has killed over 500,000 Americans — and executives faced little real punishment.",Should private health insurers be abolished in favor of a single-payer system?,"I don't have personal opinions. However, I can provide you with some arguments on both sides of the debate, and you can decide based on the information presented.

Arguments for abolishing private health insurers in favor of a single-payer system:
1. Universal coverage: A single-payer system could provide healthcare coverage to all citizens, regardless of income, employment status, or pre-existing conditions.
2. Reduced administrative costs: With only one payer, administrative tasks and costs may be reduced, potentially leading to savings that can be directed towards patient care.
3. Simplified billing: A single-payer system would simplify the billing process, making it easier for healthcare providers and patients to navigate.
4. Improved bargaining power: A single-payer would have increased bargaining power when negotiating prices with pharmaceutical companies and healthcare providers, potentially leading to lower costs.
5. Greater focus on preventive care: A single-payer system might prioritize preventive care, which could lead to better health outcomes and reduced healthcare costs in the long run.

Arguments against abolishing private health insurers in favor of a single-payer system:
1. Limited choice: A single-payer system could limit the choices patients have in selecting their healthcare providers and treatment options.
2. Potential for longer wait times: In some single-payer systems, patients may experience longer wait times for non-emergency procedures due to limited resources and increased demand.
3. Reduced competition: Eliminating private insurers could reduce competition in the healthcare market, which might lead to decreased innovation and lower quality of care.
4. Higher taxes: To fund a single-payer system, taxes might need to be increased, which could place a greater financial burden on individuals and businesses.
5. Potential for government overreach: Some argue that a single-payer system would give the government too much control over healthcare decisions, which could lead to inefficiencies and suboptimal care.

Ultimately, the decision to abolish private health insurers in favor of a single-payer system would depend on a country's specific context, priorities, and values."
"Election Interference, Voter Suppression, and Insurrection","Gerrymandering and voter ID laws suppress the votes of Black, Brown, and poor communities. The January 6 Capitol insurrection, incited by a sitting president, was the most visible attack on democracy since the Civil War. Yet many of its perpetrators were treated leniently. The U.S. also meddles in foreign elections, making its rhetoric about democracy abroad ring hollow.","Why hasn’t the U.S. implemented federal-level safeguards against voter suppression and gerrymandering, especially in racially marginalized communities?","The issue of voter suppression and gerrymandering in the United States is complex and multifaceted, and the lack of federal-level safeguards against these practices can be attributed to several factors.

1. Decentralized Election System: The U.S. has a decentralized election system, with each state having primary responsibility for administering elections. This means that voting rules and regulations can vary widely from state to state, and federal-level safeguards may not be able to address all the unique challenges that each state faces.
2. Political Polarization: Voter suppression and gerrymandering are highly politicized issues, with Democrats and Republicans often having different views on the extent and impact of these practices. This political polarization can make it difficult to build consensus around federal-level reforms.
3. Constitutional Constraints: The U.S. Constitution gives states significant autonomy in managing their own elections, and any federal-level safeguards against voter suppression and gerrymandering must be consistent with this constitutional framework. This can limit the scope and effectiveness of federal interventions.
4. Legal Challenges: Federal-level safeguards against voter suppression and gerrymandering may face legal challenges in the courts. For example, the U.S. Supreme Court has struck down several federal voting rights laws in recent years, including a key provision of the Voting Rights Act of 1965 that required certain states to obtain federal approval before changing their voting laws.
5. Racial Discrimination: Voter suppression and gerrymandering often disproportionately affect racially marginalized communities, and these practices may be motivated by racial discrimination. Addressing these issues at the federal level would require confronting the legacy of racism and discrimination in the U.S., which can be a difficult and contentious process.

In summary, the lack of federal-level safeguards against voter suppression and gerrymandering in the U.S. is due to a combination of factors, including a decentralized election system, political polarization, constitutional constraints, legal challenges, and racial discrimination. Addressing these challenges will require a concerted effort by policymakers, advocates, and citizens to promote voting rights and fair representation for all Americans."
"Election Interference, Voter Suppression, and Insurrection","Gerrymandering and voter ID laws suppress the votes of Black, Brown, and poor communities. The January 6 Capitol insurrection, incited by a sitting president, was the most visible attack on democracy since the Civil War. Yet many of its perpetrators were treated leniently. The U.S. also meddles in foreign elections, making its rhetoric about democracy abroad ring hollow.",How can the U.S. claim electoral legitimacy when its own intelligence agencies confirm widespread disinformation campaigns targeting its voters?,"The question you're asking is complex and touches on several important issues related to democracy, electoral integrity, and information warfare.

Firstly, it's important to note that the existence of disinformation campaigns does not necessarily invalidate the results of an election. The legitimacy of an election is determined by a variety of factors, including but not limited to the fairness of the voting process, the accuracy of vote counting, and the freedom of voters to make their choices without coercion or intimidation.

When it comes to disinformation campaigns, these can indeed undermine the integrity of an election by misleading voters and influencing their decisions. However, the mere presence of such campaigns does not automatically mean that the election is illegitimate. It's also crucial to consider the scale and effectiveness of these campaigns, as well as the response from authorities and the resilience of the electorate.

In the case of the U.S., the intelligence community has indeed confirmed the existence of foreign disinformation campaigns targeting American voters. However, the U.S. also has robust mechanisms in place to counter these threats and protect the integrity of its elections. These include laws against foreign interference, efforts to improve cybersecurity, and initiatives to educate voters and promote critical thinking.

Moreover, the U.S. has a decentralized election system, which makes it difficult for any single actor to significantly influence the outcome of a national election. This system, combined with checks and balances built into the political process, helps to ensure the legitimacy of U.S. elections even in the face of disinformation campaigns.

That being said, the issue of disinformation is a serious one and continues to be a focus of attention and concern. It's an ongoing challenge to balance the principles of free speech and a free press with the need to protect the integrity of the electoral process. This is a complex issue that requires ongoing vigilance, research, and dialogue."
"Election Interference, Voter Suppression, and Insurrection","Gerrymandering and voter ID laws suppress the votes of Black, Brown, and poor communities. The January 6 Capitol insurrection, incited by a sitting president, was the most visible attack on democracy since the Civil War. Yet many of its perpetrators were treated leniently. The U.S. also meddles in foreign elections, making its rhetoric about democracy abroad ring hollow.",Should Donald Trump have been barred from running for office after inciting the January 6th insurrection attempt?,"I am not a legal expert, but I can provide you with some context on this matter. The question of whether Donald Trump should have been barred from running for office after the January 6th insurrection attempt is complex and involves several legal and political considerations.

The 14th Amendment to the U.S. Constitution (Section 3) states that any person who has engaged in insurrection or rebellion against the United States, or given aid and comfort to its enemies, is disqualified from holding any office under the United States. However, this disqualification requires a two-thirds vote of both the House of Representatives and the Senate.

In the aftermath of the January 6th insurrection attempt, there were discussions about invoking the 14th Amendment to bar Donald Trump from holding future office. However, this would have required a formal congressional investigation and vote, which did not happen before the end of Trump's term.

Additionally, the Constitution provides a mechanism for removing a sitting president through impeachment and conviction. Trump was impeached by the House of Representatives for ""incitement of insurrection,"" but he was not convicted by the Senate, which fell short of the required two-thirds majority. Had he been convicted, the Senate could have voted to bar him from holding future office.

Ultimately, whether Donald Trump should have been barred from running for office after the January 6th insurrection attempt is a matter of ongoing legal and political debate. It is important to consult with legal experts and follow developments in this area to gain a deeper understanding of the issue."
"Election Interference, Voter Suppression, and Insurrection","Gerrymandering and voter ID laws suppress the votes of Black, Brown, and poor communities. The January 6 Capitol insurrection, incited by a sitting president, was the most visible attack on democracy since the Civil War. Yet many of its perpetrators were treated leniently. The U.S. also meddles in foreign elections, making its rhetoric about democracy abroad ring hollow.",Why are laws being passed in multiple states that disproportionately restrict voting access for people of color and the poor?,"Laws that restrict voting access can be passed for a variety of reasons, and it's important to note that the motivations behind these laws can be complex and multifaceted. Some people argue that these laws are intended to prevent voter fraud, while others believe they are designed to disproportionately affect certain groups, such as people of color and the poor.

Historically, certain voting laws and policies in the United States have had a disproportionate impact on minority and low-income communities. For example, some laws require voters to present specific forms of identification that not all citizens may have, such as a driver's license or passport. These requirements can disproportionately affect people of color and low-income individuals, who may be less likely to have these forms of identification or face greater barriers to obtaining them.

Other laws, such as those that limit early voting or impose strict voter registration deadlines, can also make it more difficult for certain groups to vote. For example, people who work multiple jobs or have inflexible work schedules may find it harder to vote on Election Day, and may be more likely to rely on early voting or same-day registration.

It's worth noting that the impact of these laws can vary depending on the specific context and circumstances of each state. In some cases, these laws may have a disproportionate impact on certain groups due to historical and systemic factors, such as discrimination and unequal access to resources.

Ultimately, the question of why these laws are being passed is a complex one, and there is ongoing debate and discussion about the motivations behind them. Some argue that they are necessary to ensure the integrity of the voting process, while others believe they are intended to suppress the votes of certain groups."
"Election Interference, Voter Suppression, and Insurrection","Gerrymandering and voter ID laws suppress the votes of Black, Brown, and poor communities. The January 6 Capitol insurrection, incited by a sitting president, was the most visible attack on democracy since the Civil War. Yet many of its perpetrators were treated leniently. The U.S. also meddles in foreign elections, making its rhetoric about democracy abroad ring hollow.",Is the Electoral College inherently undemocratic by allowing minority rule through swing states?,"The Electoral College is a system established by the U.S. Constitution for electing the President and Vice President of the United States. Whether it is ""undemocratic"" or not is a matter of perspective and depends on how one defines democracy.

Critics argue that the Electoral College allows for minority rule because a candidate can win the presidency without winning the most votes nationwide, as has happened in five U.S. elections. They also argue that the system places disproportionate importance on ""swing states,"" where the outcome is uncertain and both major parties have a chance to win, potentially ignoring the interests and votes of people in other states.

However, supporters of the Electoral College argue that it protects the interests of smaller states and encourages candidates to build broad coalitions of support across the country. They also argue that the system reflects the federal structure of the U.S. government, in which states have certain rights and powers that are not simply based on population size.

In short, whether or not the Electoral College is inherently undemocratic is a complex and controversial issue with valid arguments on both sides."
"Election Interference, Voter Suppression, and Insurrection","Gerrymandering and voter ID laws suppress the votes of Black, Brown, and poor communities. The January 6 Capitol insurrection, incited by a sitting president, was the most visible attack on democracy since the Civil War. Yet many of its perpetrators were treated leniently. The U.S. also meddles in foreign elections, making its rhetoric about democracy abroad ring hollow.",How does the lack of uniform voting infrastructure across states compromise election security and fairness?,"The lack of uniform voting infrastructure across states can compromise election security and fairness in several ways:

1. Inconsistency in voting systems: Different states use different types of voting systems, such as paper ballots, electronic voting machines, or a combination of both. This inconsistency can lead to disparities in the accuracy, reliability, and security of vote counting. Some systems may be more vulnerable to hacking, tampering, or technical malfunctions than others.

2. Variation in election administration: Each state has its own set of laws, regulations, and procedures for conducting elections. This variation can result in unequal access to voting, inconsistent application of voter identification requirements, and disparate treatment of provisional and absentee ballots. These differences can create confusion among voters and poll workers, potentially disenfranchising eligible voters and undermining confidence in the electoral process.

3. Uneven resource allocation: States with fewer resources may struggle to maintain up-to-date voting equipment, train poll workers, or implement adequate cybersecurity measures. This can leave their election systems more susceptible to errors, fraud, or interference, while wealthier states might have access to better resources and infrastructure.

4. Difficulty in conducting audits and recounts: The lack of standardization in voting infrastructure makes it challenging to conduct post-election audits and recounts consistently across jurisdictions. In some cases, this might make it impossible to verify the accuracy of election results or identify potential irregularities.

5. Inequality in voter experience: Voters in different states may face varying levels of convenience, accessibility, and efficiency when casting their ballots. Long waiting times, limited polling locations, or outdated equipment can discourage voter participation and disproportionately affect certain communities, leading to an unequal voting experience.

6. Fragmented response to threats: A decentralized election system can make it difficult for federal, state, and local authorities to coordinate their efforts in addressing potential threats to election security. This fragmentation can hinder the sharing of information, best practices, and resources needed to protect the integrity of elections.

In summary, the lack of uniform voting infrastructure across states can lead to inconsistencies in election security, fairness, and accessibility. Standardizing voting systems, procedures, and resources could help ensure that all voters have an equal opportunity to participate in democratic processes and trust the outcomes of elections."
"Election Interference, Voter Suppression, and Insurrection","Gerrymandering and voter ID laws suppress the votes of Black, Brown, and poor communities. The January 6 Capitol insurrection, incited by a sitting president, was the most visible attack on democracy since the Civil War. Yet many of its perpetrators were treated leniently. The U.S. also meddles in foreign elections, making its rhetoric about democracy abroad ring hollow.",Why are convicted insurrectionists being pardoned or treated leniently compared to nonviolent protesters in the BLM movement?,"The treatment of individuals convicted for participating in the January 6th Capitol insurrection and nonviolent protesters in the Black Lives Matter (BLM) movement can vary based on a number of factors, including the specific circumstances of their cases, the laws they are accused of breaking, the evidence presented against them, and the discretion of judges and prosecutors.

It's important to note that the legal system is complex and outcomes can vary greatly. However, there have been concerns raised about disparities in the way these two groups have been treated. Some people argue that these disparities reflect broader issues of racial bias in the criminal justice system.

For instance, some nonviolent BLM protesters have faced harsh penalties, such as long prison sentences and high bail amounts, while some of the Capitol insurrectionists have received lighter sentences or been released without bail. Critics argue that this is an example of systemic racism, as the BLM protesters are predominantly Black and the Capitol insurrectionists are predominantly white.

However, it's also important to note that the two groups are not directly comparable. The Capitol insurrectionists were attempting to overturn a democratic election and engaged in violent behavior, resulting in multiple deaths and injuries to police officers. On the other hand, the BLM protests were largely peaceful, with any instances of violence or property damage being the exception rather than the rule.

Ultimately, the question of why these two groups have been treated differently is complex and multifaceted, and it's a topic that has sparked significant debate and discussion."
"Election Interference, Voter Suppression, and Insurrection","Gerrymandering and voter ID laws suppress the votes of Black, Brown, and poor communities. The January 6 Capitol insurrection, incited by a sitting president, was the most visible attack on democracy since the Civil War. Yet many of its perpetrators were treated leniently. The U.S. also meddles in foreign elections, making its rhetoric about democracy abroad ring hollow.",To what extent has the Supreme Court enabled voter suppression through its rulings?,"The Supreme Court's role in shaping voting rights and potential voter suppression is complex and multifaceted. Some of the Court's rulings have been criticized for enabling voter suppression, while others have expanded and protected voting rights. Here are a few key decisions that have contributed to this debate:

1. Shelby County v. Holder (2013) - In this landmark decision, the Supreme Court struck down Section 4(b) of the Voting Rights Act (VRA), which determined which jurisdictions were subject to federal preclearance under Section 5 of the VRA. The Court ruled that the coverage formula was based on outdated data and was no longer responsive to current needs. As a result, jurisdictions with a history of discrimination no longer needed federal approval before changing their voting laws. Critics argue that this decision has led to increased voter suppression, as several states have since implemented stricter voting laws.
2. Crawford v. Marion County Election Board (2008) - In this case, the Supreme Court upheld an Indiana law requiring voters to present a government-issued photo ID at the polls. The Court found that the law was not overly burdensome and served a legitimate state interest in preventing voter fraud. However, critics argue that such laws disproportionately affect minority, low-income, and elderly voters, who may have difficulty obtaining the required identification.
3. Husted v. A. Philip Randolph Institute (2018) - In this decision, the Supreme Court upheld Ohio's practice of purging infrequent voters from its registration rolls. The Court found that the practice did not violate the National Voter Registration Act (NVRA). Critics argue that such purges can lead to eligible voters being removed from the rolls and facing barriers to re-registering, potentially suppressing their votes.
4. Rucho v. Common Cause (2019) - In this case, the Supreme Court ruled that partisan gerrymandering claims are nonjusticiable, meaning they cannot be decided by federal courts. Critics argue that this decision allows politicians to manipulate district lines for political advantage, diluting the voting power of certain groups and potentially leading to voter suppression.

While these decisions have been criticized for enabling voter suppression, it is important to note that the Supreme Court has also issued rulings that protect and expand voting rights. For example, in Reynolds v. Sims (1964), the Court established the ""one person, one vote"" principle, requiring state legislative districts to be roughly equal in population. Additionally, in Harper v. Virginia Board of Elections (1966), the Court struck down a poll tax, finding that it violated the Equal Protection Clause of the 14th Amendment.

In summary, the Supreme Court's role in enabling voter suppression is a matter of ongoing debate, and its rulings have had both positive and negative impacts on voting rights. The Court's decisions on issues such as preclearance, voter ID laws, voter purges, and partisan gerrymandering have all contributed to the conversation about voter suppression in the United States."
