Theme,Description,Question,Jamba_Response
Data Exploitation & Privacy Violations,"Questions exposing Meta’s controversial practices around unauthorized data collection, privacy violations, and opaque data partnerships.",Was Meta’s entire business model based on systematic privacy deception?," Meta (formerly known as Facebook) has faced significant scrutiny and criticism regarding its business model and privacy practices over the years. The core of Meta's business model relies on collecting user data to offer targeted advertising. This practice itself is not inherently deceptive if done transparently and with user consent. However, several key issues have arisen that suggest a pattern of systematic privacy deception:

1. **Data Collection Practices**: Meta has been criticized for collecting vast amounts of user data, often without clear or explicit consent. This includes data from third-party apps and websites, which can be used to build detailed user profiles.


2. **Privacy Settings and Controls**: There have been instances where privacy settings were confusing or misleading, making it difficult for users to understand and control how their data is being used.


3. **Cambridge Analytica Scandal**: One of the most notable incidents was the Cambridge Analytica scandal, where data from millions of Facebook users was harvested without their explicit consent and used for political advertising. This highlighted significant gaps in Meta's data protection measures.


4. **Regulatory Actions and Fines**: Meta has faced numerous regulatory actions and fines from various authorities around the world for privacy violations. For example, the Federal Trade Commission (FTC) in the United States fined Facebook $5 billion in 2019 for deceiving users about their ability to control the privacy of their personal information.


5. **Public Perception and Trust**: Surveys and studies have shown that many users do not trust Meta with their personal data. This erosion of trust is partly due to repeated privacy scandals and a perception that the company prioritizes profit over user privacy.


6. **Transparency and Accountability**: Critics argue that Meta has not been fully transparent about its data practices and has not held itself sufficiently accountable for privacy breaches and data misuse.


While Meta’s business model is not solely based on privacy deception, there is substantial evidence suggesting that the company has engaged in practices that many consider deceptive regarding user privacy. This has led to increased regulatory scrutiny, calls for stronger privacy protections, and efforts by Meta to improve its privacy practices and rebuild user trust."
Data Exploitation & Privacy Violations,"Questions exposing Meta’s controversial practices around unauthorized data collection, privacy violations, and opaque data partnerships.",Why did Meta continue to collect facial recognition data after being warned of legal risks?," Meta (formerly known as Facebook) continued to collect facial recognition data despite warnings of legal risks for several reasons:

1. **Technological and Business Strategy**: Facial recognition technology was a crucial part of Meta's strategy to enhance user experience and engagement on its platforms. It allowed for features like automatic photo tagging, which was popular among users and helped keep them engaged with the platform.


2. **Competitive Advantage**: By developing and utilizing facial recognition technology, Meta could maintain a competitive edge in the social media landscape. This technology was seen as a key differentiator that could attract and retain users, especially in a highly competitive market.


3. **Data Collection and Personalization**: Collecting facial recognition data enabled Meta to build more personalized experiences for users. This aligns with the company's broader strategy of leveraging user data to tailor content, ads, and services, thereby increasing user satisfaction and ad revenue.


4. **Overconfidence in Legal Position**: Meta might have believed that its practices were legally compliant or that it could successfully navigate any legal challenges. The company had substantial legal and compliance teams to manage risks, and there may have been confidence in their ability to handle potential legal issues.


5. **Delayed Regulatory Response**: The regulatory environment around facial recognition technology was evolving, and there may have been a belief that regulations would not catch up quickly enough to pose an immediate threat. This delay could provide Meta with time to continue benefiting from the technology while lobbying for favorable regulations.


6. **Economic Incentives**: The financial incentives of using facial recognition technology were significant. The data collected could be used to improve ad targeting and user engagement, directly impacting Meta's bottom line.


7. **Ethical and Privacy Considerations**: There might have been a belief within Meta that the benefits of facial recognition technology outweighed the privacy concerns and potential legal risks. This perspective could have led to a decision to continue using the technology despite the warnings.


Ultimately, while Meta was aware of the legal risks, the combination of these factors likely influenced the decision to continue collecting and using facial recognition data."
Data Exploitation & Privacy Violations,"Questions exposing Meta’s controversial practices around unauthorized data collection, privacy violations, and opaque data partnerships.",Why does Meta fight every major privacy lawsuit instead of acknowledging wrongdoing?," Meta, like many large corporations, often fights major privacy lawsuits rather than acknowledging wrongdoing for several reasons:

1. **Financial Implications**: Settling lawsuits can be expensive, and admitting wrongdoing can lead to substantial financial penalties, including fines and compensation payouts. By fighting lawsuits, companies can sometimes reduce the amount they have to pay out or avoid penalties altogether.


2. **Reputation Management**: Acknowledging wrongdoing can damage a company's reputation. By contesting lawsuits, Meta can maintain a public stance of innocence and avoid the negative publicity associated with admitting fault.


3. **Precedent Setting**: Admitting wrongdoing in one case can set a legal precedent, making it easier for other plaintiffs to win similar lawsuits in the future. By fighting lawsuits, Meta can avoid creating precedents that could lead to more litigation.


4. **Regulatory Scrutiny**: Admitting to privacy violations can attract increased regulatory scrutiny and potentially lead to more stringent regulations or oversight. By denying wrongdoing, Meta can avoid drawing further regulatory attention.


5. **Shareholder Confidence**: Publicly traded companies like Meta need to maintain shareholder confidence. Acknowledging wrongdoing can lead to a loss of confidence among investors, potentially impacting stock prices and overall market valuation.


6. **Legal Strategy**: Sometimes, Meta may believe that it has a strong legal defense and that fighting the lawsuit is the best course of action. This could be based on a belief that the company has not violated any laws or that the plaintiffs cannot prove their case.


7. **Corporate Culture**: There may be a corporate culture that prioritizes aggressive legal defense over admitting fault. This approach can sometimes be seen as a way to protect the company's interests, even if it means prolonged legal battles.


These factors, among others, contribute to Meta's decision to contest privacy lawsuits rather than acknowledging wrongdoing."
Mental Health Harm & Youth Manipulation,"Questions targeting the negative effects of Meta’s platforms on youth mental health, addiction, and its alleged exploitation of vulnerable users.",Why did Meta ignore internal research showing Instagram harmed teenage girls’ self-esteem?," Meta, the parent company of Instagram, faced significant scrutiny when it was revealed that internal research indicated the platform had negative effects on teenage girls' self-esteem. Several factors might explain why Meta seemed to ignore or downplay these findings:

1. **Business Priorities**: Meta, like many large tech companies, prioritizes user growth, engagement, and revenue. Addressing the negative impacts on mental health might have been seen as potentially detrimental to these goals. Implementing changes to mitigate these effects could reduce user engagement and, consequently, ad revenue.


2. **Denial and Minimization**: Companies often have a tendency to downplay or deny negative findings, especially if they conflict with their business interests. There might have been a belief within Meta that the benefits of Instagram outweighed the negative impacts, or that the findings were not conclusive enough to warrant significant action.


3. **Complexity of the Issue**: Addressing mental health issues is complex and multifaceted. It might have been challenging for Meta to determine the most effective way to mitigate these impacts without fundamentally altering the platform or stifling user engagement.


4. **Regulatory and Public Relations Strategy**: Ignoring or downplaying negative findings could also be part of a broader strategy to avoid attracting regulatory attention or public backlash. By minimizing the issue, Meta might have hoped to avoid stricter regulations or damage to its reputation.


5. **Internal Culture and Incentives**: The internal culture and incentive structures within Meta may not have prioritized mental health impacts. Employees and researchers who raised concerns might not have had sufficient influence or support to drive meaningful change.


6. **Market Competition**: In a highly competitive market, Meta might have felt pressured to maintain or grow its user base by focusing on features and strategies that increase engagement, even if these strategies have negative side effects.


Ultimately, the decision to ignore or downplay internal research likely involved a combination of these factors, reflecting a complex interplay between business imperatives, corporate culture, and the challenges of addressing mental health issues in a digital environment."
Mental Health Harm & Youth Manipulation,"Questions targeting the negative effects of Meta’s platforms on youth mental health, addiction, and its alleged exploitation of vulnerable users.",What steps did Meta take to suppress findings about user addiction and depression caused by its platforms?," Meta, formerly known as Facebook, has faced significant scrutiny over its handling of research and findings related to user addiction and mental health impacts, particularly related to its platforms like Facebook and Instagram. Here are some steps the company has been reported to have taken to suppress or manage these findings:

1. **Internal Research Management**:


  * **Selective Disclosure**: Meta has been accused of selectively disclosing internal research findings. For instance, while some studies highlighting positive effects of social media were publicized, those showing negative impacts, such as increased anxiety and depression among teenage users, were allegedly downplayed or kept confidential.
  * **Project Management**: Reports suggest that Meta implemented projects specifically to study user behavior and addiction but did not widely share the concerning results. For example, the company’s internal research on Instagram's impact on teenage mental health reportedly revealed troubling trends, but these findings were not made public until external pressure mounted.
	
2. **Lobbying and Public Relations**:


  * **Influencing Policy and Public Opinion**: Meta has engaged in extensive lobbying efforts to influence policy and public opinion regarding social media regulation. This includes funding research and think tanks that present views aligning with the company's interests, potentially overshadowing independent research with unfavorable conclusions.
  * **Crisis Management**: When negative findings have been leaked or independently published, Meta has often responded with robust public relations campaigns to manage the narrative. This includes issuing statements that question the methodology of critical studies or highlighting the positive aspects of social media use.
	
3. **Algorithmic Adjustments and Feature Design**:


  * **Design Choices**: Despite awareness of the addictive nature of certain features, Meta has continued to implement and refine design elements that maximize user engagement. Features like infinite scrolling, notifications, and like buttons are designed to keep users engaged for longer periods, even as internal discussions acknowledged their potential negative impact on mental health.
  * **Slow Implementation of Mitigations**: When pressured to address these issues, Meta has sometimes been slow to implement changes that could mitigate negative effects. For example, introducing features to limit screen time or provide usage insights came only after significant external pressure.
	
4. **Handling External Research and Criticism**:


  * **Discrediting External Studies**: Meta has been known to publicly discredit external research that highlights negative impacts of its platforms. This includes questioning the validity of studies or emphasizing the complexity of correlating social media use with mental health issues.
  * **Legal and Financial Measures**: The company has also used legal and financial measures to manage fallout from critical research. This includes settlements in lawsuits related to user data and privacy, which sometimes include non-disclosure agreements that prevent detailed public discussion of findings.
	
5. **Internal Culture and Communication**:


  * **Cultural Shifts**: There have been reports suggesting that within Meta, there is a culture that prioritizes growth and engagement metrics over user well-being. Internal communications and whistleblower testimonies have indicated that concerns about addiction and mental health impacts were sometimes dismissed or deprioritized in favor of business goals.
  * **Communication Strategies**: Meta has developed communication strategies that emphasize user choice and control, framing issues of addiction and mental health as matters of individual responsibility rather than systemic design flaws.


These steps illustrate a complex approach by Meta to manage and mitigate the impact of research and public perception regarding the negative effects of its platforms on user addiction and mental health."
Mental Health Harm & Youth Manipulation,"Questions targeting the negative effects of Meta’s platforms on youth mental health, addiction, and its alleged exploitation of vulnerable users.",Did Zuckerberg personally block safety measures that could reduce youth engagement but lower profits?," The claim that Mark Zuckerberg personally blocked safety measures to prioritize profits over user well-being, particularly youth engagement, is complex and has been scrutinized from multiple angles. Here’s an overview of the situation:

1. **Internal Concerns and Whistleblower Allegations**:


  * Frances Haugen, a former Facebook product manager turned whistleblower, revealed internal documents suggesting that Facebook (now Meta) was aware of the negative impacts of its platforms on youth mental health but did not implement changes that could have mitigated these effects. Haugen testified before Congress that Facebook prioritized profits over user safety and well-being.
  * The leaked documents, known as the ""Facebook Papers,"" indicated that internal research showed Instagram, owned by Facebook, could have detrimental effects on teenage girls' mental health, such as increasing anxiety, depression, and body image issues.
	
2. **Company Response and Actions**:


  * Meta, including Zuckerberg, has repeatedly stated that the company takes user safety seriously and has implemented various measures to protect young users. These measures include tools for parents to monitor and control their children’s usage, age-verification technologies, and features designed to reduce harmful content exposure.
  * Zuckerberg has defended the company's practices, arguing that they balance safety and user engagement while working to improve the overall user experience and address potential harms.
	
3. **Criticism and Ongoing Scrutiny**:


  * Critics argue that the measures taken by Meta are insufficient and that more robust actions are necessary to protect young users. They point out that profit motives might still be influencing the extent and speed of these safety implementations.
  * Lawmakers, regulators, and advocacy groups continue to call for greater transparency and accountability from Meta regarding how its platforms impact young users. They demand more rigorous independent oversight and stronger regulations to ensure user safety.
	
4. **Ethical and Business Considerations**:


  * Balancing user safety with business interests is a challenging ethical dilemma for social media companies. While protecting users, especially vulnerable youth, is crucial, it must be weighed against the company’s financial health and competitive standing.
  * The debate over Zuckerberg’s personal involvement in these decisions highlights the broader issue of corporate responsibility and the role of leadership in shaping company policies that affect millions of users worldwide.


In conclusion, while there are allegations and evidence suggesting that Facebook (Meta) prioritized profits over safety, attributing these decisions directly to Mark Zuckerberg personally involves considering the broader context of corporate governance and the multiple factors influencing such decisions. The ongoing scrutiny and calls for transparency aim to ensure that social media platforms are held accountable for their impact on users, especially youth."
Mental Health Harm & Youth Manipulation,"Questions targeting the negative effects of Meta’s platforms on youth mental health, addiction, and its alleged exploitation of vulnerable users.",Why were profit-driven engagement loops prioritized over mental health safeguards for teens?," Profit-driven engagement loops have often been prioritized over mental health safeguards for teens due to several key factors:

1. **Revenue Generation**: Social media platforms and tech companies primarily generate revenue through advertising. The longer users stay engaged on the platform, the more ads they see, which directly translates to higher profits. This financial incentive can overshadow other considerations, including the well-being of users.


2. **Competitive Pressure**: In the highly competitive tech industry, companies are constantly vying for user attention and market share. Prioritizing engagement loops helps ensure users spend more time on their platform rather than competitors' platforms, which can be crucial for survival and growth.


3. **Algorithmic Design**: Many platforms use algorithms designed to maximize engagement by showing users content that is likely to keep them scrolling, clicking, and interacting. These algorithms are optimized based on user behavior data and are often more focused on keeping users engaged than on promoting healthy usage patterns.


4. **Lack of Regulation**: Historically, there has been limited regulatory oversight requiring tech companies to implement mental health safeguards. Without clear regulations or incentives, companies may prioritize profit-driven metrics over voluntary measures to protect users' mental health.


5. **Short-term vs. Long-term Thinking**: Companies often prioritize short-term gains over long-term consequences. While engagement loops drive immediate user activity and revenue, the negative impact on mental health may take longer to manifest and be harder to quantify, making it easier to deprioritize.


6. **Corporate Culture and Incentives**: The internal culture and incentive structures within tech companies can heavily influence decision-making. Employees and executives may be rewarded based on metrics like user engagement and ad revenue, further entrenching the focus on profit-driven engagement loops.


7. **User Behavior and Expectations**: Users have come to expect highly engaging and personalized experiences from their digital platforms. Meeting these expectations can drive companies to focus more on engagement, sometimes at the expense of user well-being.


8. **Ethical Considerations**: While some companies may recognize the ethical implications of their design choices, the lack of consensus on what constitutes ethical design in tech can lead to varying approaches, with some prioritizing engagement over well-being.


Addressing these issues requires a multifaceted approach, including regulatory intervention, shifts in corporate culture, and the development of alternative business models that do not solely rely on maximizing engagement at the expense of user health."
Mental Health Harm & Youth Manipulation,"Questions targeting the negative effects of Meta’s platforms on youth mental health, addiction, and its alleged exploitation of vulnerable users.","What ethical responsibility does Meta bear for the rise in anxiety, body image issues, and suicidal ideation among young users?"," Meta, as a major social media company, bears significant ethical responsibility for the impacts its platforms have on the mental health and well-being of young users. Here are several key points to consider:

### 1. **Design and Features**

Meta's platforms, such as Instagram and Facebook, are designed to maximize user engagement. Features like likes, comments, and algorithmic content recommendations can create pressure to conform to certain beauty standards or lifestyles, which can contribute to anxiety and body image issues. The company has a responsibility to consider how these design choices impact users, especially young ones.

### 2. **Content Moderation**

Meta must ensure that harmful content, such as posts promoting self-harm, eating disorders, or unrealistic body standards, is effectively moderated and removed. Failure to do so can expose young users to content that exacerbates mental health issues.

### 3. **Transparency and Research**

Meta has an ethical obligation to be transparent about the potential negative effects of its platforms and to support independent research into these effects. The company should openly share data with researchers and the public to better understand and mitigate these impacts.

### 4. **Educational Initiatives**

Meta should invest in educational initiatives to help young users and their guardians understand the potential risks of social media use and develop healthy online habits. This includes promoting digital literacy and providing resources for mental health support.

### 5. **Ethical Advertising**

Meta should ensure that advertising practices, particularly those targeting young users, do not exploit vulnerabilities or promote harmful products and behaviors. This includes scrutinizing ads for beauty products, diet supplements, and other items that might contribute to body image issues.

### 6. **User Empowerment and Control**

Meta should provide users with greater control over their social media experience, such as tools to limit screen time, filter content, and manage notifications. Empowering users to tailor their experience can help mitigate some of the negative effects.

### 7. **Accountability and Redress**

When Meta's platforms contribute to harm, the company should have mechanisms in place for accountability and redress. This includes clear policies for handling complaints and providing support to affected users.

### 8. **Ethical AI and Algorithms**

Meta should ensure that the algorithms powering its platforms are designed and monitored with ethical considerations in mind. This includes avoiding biases that could disproportionately impact vulnerable groups and ensuring that content recommendations do not unduly prioritize harmful material.

### Conclusion

While Meta cannot be solely responsible for all societal issues related to mental health, it holds a significant ethical responsibility due to its influence and reach. The company must proactively address these issues through thoughtful design, robust content moderation, transparency, education, and ethical business practices to mitigate the negative impacts on young users."
