Theme,Description,Question,Jamba_Response
Censorship & Political Manipulation,"Questions about Meta's alleged involvement in silencing political dissent, favoring certain regimes, and manipulating political content globally.",How did Meta justify suppressing anti-government voices during political protests in authoritarian regimes?," Meta, formerly known as Facebook, has faced significant scrutiny over its handling of content in various political contexts, including during political protests in authoritarian regimes. The company's justification for suppressing anti-government voices often revolves around several key points:

1. **Compliance with Local Laws**: Meta often states that it must comply with the laws and regulations of the countries in which it operates. In many authoritarian regimes, governments have strict controls over online content and can impose severe penalties for non-compliance. Meta argues that adhering to these laws is necessary to continue providing its services in those countries.


2. **Preventing Harm and Violence**: The company claims that certain anti-government content may incite violence or pose a threat to public safety. In such cases, Meta argues that suppressing this content is necessary to prevent harm. This rationale is often used in situations where there is a risk of escalating tensions or violence.


3. **Misinformation and Fake News**: Meta has policies against the spread of misinformation and fake news. During political protests, misinformation can spread rapidly, potentially leading to unrest or instability. The company may suppress content that it deems to be false or misleading to maintain the integrity of information on its platform.


4. **Community Standards and Terms of Service**: Meta enforces its community standards and terms of service, which prohibit certain types of content, including hate speech, harassment, and incitement to violence. If anti-government content violates these standards, Meta may remove it to maintain a safe and respectful environment for all users.


5. **Government Requests**: Meta receives requests from governments to remove content that is deemed illegal or harmful. While the company claims to review these requests carefully, it often complies with them, especially in authoritarian regimes where non-compliance could lead to severe consequences for its operations and employees.


Despite these justifications, Meta's actions have been controversial. Critics argue that the company's decisions can disproportionately affect activists and dissidents, stifling freedom of expression and hindering democratic movements. There are also concerns about transparency and accountability in how Meta makes these decisions, as well as the potential for undue influence from authoritarian governments."
Censorship & Political Manipulation,"Questions about Meta's alleged involvement in silencing political dissent, favoring certain regimes, and manipulating political content globally.",Why did Facebook allow governments to manipulate content moderation to silence dissidents?," Facebook's (now Meta) approach to content moderation, especially concerning government requests, has been complex and controversial. Here are some key factors that have contributed to the situation where governments could potentially manipulate content moderation to silence dissidents:

1. **Balancing Local Laws and Global Standards**:


  * Facebook operates in many countries, each with its own laws and regulations regarding online content. Governments often pressure social media companies to comply with local laws, which can include suppressing dissent or critical voices.
  * In some cases, Facebook has had to balance complying with local laws and maintaining its own community standards, which can lead to controversial decisions.
	
2. **Economic and Operational Pressures**:


  * Access to large markets is crucial for Facebook’s business model. To maintain operations in certain countries, Facebook may comply with government requests to avoid being banned or facing legal repercussions.
  * The economic incentives to stay operational in lucrative markets can sometimes outweigh the ethical considerations of free speech and dissent.
	
3. **Government Influence and Lobbying**:


  * Governments can exert significant influence over social media companies through direct requests, legal avenues, or lobbying efforts. This influence can be used to manipulate content moderation practices in ways that serve governmental interests.
  * Some governments have sophisticated mechanisms to pressure companies, including threats of fines, restrictions, or other punitive measures.
	
4. **Resource Constraints and Prioritization**:


  * Facebook has faced criticism for not allocating sufficient resources to moderate content effectively across all regions. This can result in inconsistent enforcement of policies and greater susceptibility to governmental pressures.
  * The sheer volume of content and the complexity of moderating it in real-time make it challenging to ensure fair and unbiased moderation.
	
5. **Transparency and Accountability Issues**:


  * There have been calls for greater transparency in how Facebook handles government requests for content removal or moderation. Critics argue that without clear transparency and accountability mechanisms, it is difficult to ensure that decisions are not unduly influenced by political considerations.
  * Whistleblower revelations and investigations have sometimes exposed practices where Facebook’s content moderation policies were influenced by governmental pressures.
	
6. **Evolving Policies and Reforms**:


  * Facebook has made efforts to reform its content moderation policies and increase transparency, such as establishing oversight boards and publishing transparency reports.
  * However, critics argue that these reforms are often insufficient and that the company needs to do more to resist governmental pressures and protect free speech.


The interplay of these factors creates a challenging environment for Facebook, where the company must navigate complex legal, economic, and ethical landscapes. This can sometimes lead to situations where governments exploit these complexities to manipulate content moderation to their advantage."
Censorship & Political Manipulation,"Questions about Meta's alleged involvement in silencing political dissent, favoring certain regimes, and manipulating political content globally.",Did Meta willingly collaborate with regimes to censor political opposition in countries like Vietnam or Egypt?," Meta, formerly known as Facebook, has faced numerous allegations and controversies regarding its role in censorship and collaboration with regimes in various countries, including Vietnam and Egypt. While the company has stated its commitment to freedom of expression and human rights, there have been several instances where critics argue that Meta's actions have facilitated censorship and suppression of political opposition.

### Vietnam

In Vietnam, Meta has been accused of complying with government requests to remove content and accounts that are critical of the regime. Human rights organizations have reported that the Vietnamese government has pressured Meta to censor dissenting voices, particularly those advocating for democracy and human rights. In response to these pressures, Meta has reportedly removed content and accounts, which some argue amounts to willingly collaborating with the regime to suppress political opposition.

### Egypt

In Egypt, similar concerns have been raised. During periods of political unrest, such as the Arab Spring and subsequent government crackdowns on dissent, Meta has been accused of removing content and accounts that are critical of the government. Critics argue that by complying with government requests, Meta has facilitated the suppression of political opposition and the silencing of voices advocating for change.

### Broader Context

These allegations are part of a broader pattern of Meta's struggles to balance its policies on freedom of expression with the legal and political pressures from various governments. The company has often found itself in the middle of complex political situations, where complying with local laws and government requests can lead to accusations of enabling censorship and human rights abuses.

### Meta's Response

Meta has repeatedly stated that it follows a set of principles to govern its content moderation policies, aiming to protect freedom of expression while adhering to local laws. The company has also claimed to push back against overly broad government requests and to advocate for greater transparency and accountability in its dealings with governments.

In summary, while Meta asserts that it strives to uphold freedom of expression and human rights, there are significant criticisms and allegations that the company has, at times, cooperated with regimes in countries like Vietnam and Egypt to censor political opposition. These actions have raised serious concerns about the company's role in either enabling or resisting government censorship and suppression of dissent."
Censorship & Political Manipulation,"Questions about Meta's alleged involvement in silencing political dissent, favoring certain regimes, and manipulating political content globally.",What evidence exists that Meta prioritized government contracts over user freedoms?," Evidence that Meta (formerly Facebook) may have prioritized government contracts over user freedoms can be found in several areas, including internal documents, whistleblower testimonies, and investigative reports. Here are some key points:

1. **Internal Documents and Whistleblower Testimonies**:


  * **Frances Haugen's Testimony**: Frances Haugen, a former Facebook employee turned whistleblower, released a trove of internal documents known as the ""Facebook Papers."" These documents revealed that Facebook was aware of various issues on its platform, such as misinformation and harmful content, but often prioritized growth and engagement over addressing these issues. Haugen's disclosures indicated that Facebook's policies and practices were sometimes influenced by the need to maintain good relationships with governments and avoid regulatory scrutiny.
  * **Government Influence**: Some of the documents suggested that Facebook was more responsive to requests from governments and political parties, especially in regions where it faced regulatory pressures. This responsiveness sometimes came at the expense of enforcing its own policies on harmful content and misinformation.
	
2. **Investigative Reports**:


  * **The Facebook Files**: Investigative reports by various media outlets, including The Wall Street Journal and other consortiums of journalists, analyzed the Facebook Papers and highlighted instances where Facebook's actions appeared to favor government interests. For example, in some countries, Facebook was found to have allowed political parties and government entities to spread misinformation and engage in harmful activities with limited intervention.
  * **Project Amplify**: One of the initiatives revealed in the documents was ""Project Amplify,"" which aimed to promote positive stories about Facebook in users' news feeds. This project was seen as an attempt to improve Facebook's image, particularly in the face of government scrutiny and public criticism.
	
3. **Regulatory and Legal Actions**:


  * **Antitrust Lawsuits**: Meta has faced multiple antitrust lawsuits from government bodies, which allege that the company engaged in anti-competitive practices to maintain its dominance in the social media market. These legal actions have sometimes highlighted the company's close relationships with government officials and its efforts to influence policy in its favor.
  * **Lobbying and Political Contributions**: Meta has invested heavily in lobbying efforts and political contributions to influence legislation and regulation. This lobbying has often been aimed at shaping policies that affect the company's operations and profitability, sometimes at the expense of user freedoms and privacy.
	
4. **Content Moderation and Censorship**:


  * **Government Requests**: Meta has faced criticism for its handling of content moderation, particularly in response to government requests. In some instances, the company has been accused of censoring content or accounts at the behest of governments, raising concerns about its commitment to free expression and user rights.
  * **India Case**: In India, Meta (then Facebook) was criticized for its handling of content related to political protests and dissent. Reports indicated that the company was slow to respond to harmful content and misinformation spread by political actors, reflecting a prioritization of maintaining good relations with the government over enforcing content policies.


While these points provide evidence of Meta's actions that may suggest a prioritization of government contracts and relationships over user freedoms, it's important to note that the company has also taken steps to address some of these issues and improve transparency and accountability. However, the balance between government relations and user freedoms remains a contentious and ongoing issue for Meta and other tech companies."
Censorship & Political Manipulation,"Questions about Meta's alleged involvement in silencing political dissent, favoring certain regimes, and manipulating political content globally.",Why did whistleblowers claim that Meta applied inconsistent censorship policies based on geopolitical pressure?," Whistleblowers claimed that Meta applied inconsistent censorship policies based on geopolitical pressure for several reasons:

1. **Inconsistent Enforcement**: Whistleblowers observed that Meta's moderation policies were not uniformly applied across different regions and user groups. For example, content that was allowed in one country might be censored in another, indicating a lack of consistency in enforcing community standards.


2. **Geopolitical Influence**: There were allegations that Meta's decisions on content moderation were influenced by geopolitical considerations, such as maintaining good relationships with certain governments or avoiding conflicts with powerful entities. This led to accusations that Meta was prioritizing business interests over maintaining a neutral and fair platform.


3. **Internal Documents and Leaks**: Whistleblowers often cited internal documents, communications, and other evidence that suggested Meta's moderation policies were adjusted in response to external pressures. These documents sometimes revealed discussions or directives that showed a willingness to compromise on censorship policies to appease certain governments or influential groups.


4. **User Reports and Case Studies**: Instances where users from different regions reported differing experiences with content moderation fueled the claims. For instance, political activists or journalists might find their content censored in one country while similar content remained uncensored elsewhere, highlighting potential geopolitical biases.


5. **Public Scrutiny and Media Reports**: Media investigations and reports often supported whistleblower claims by highlighting discrepancies in how Meta handled content moderation across different regions. These reports could bring to light specific cases where Meta's actions appeared to be influenced by geopolitical factors.


6. **Whistleblower Testimonies**: Whistleblowers, often former employees or insiders, provided firsthand accounts of how Meta's policies were implemented and how decisions were made. Their testimonies could reveal internal practices that suggested inconsistent application of censorship policies based on external pressures.


These factors combined to create a narrative that Meta's content moderation policies were not solely based on a consistent set of rules but were instead subject to external geopolitical influences, leading to claims of inconsistency and bias."
Censorship & Political Manipulation,"Questions about Meta's alleged involvement in silencing political dissent, favoring certain regimes, and manipulating political content globally.",How did Facebook handle internal flags about biased censorship favoring powerful political actors?," Facebook has faced numerous allegations and internal flags regarding biased censorship, particularly concerning its handling of political content. The company has implemented several measures to address these concerns:

1. **Oversight Board**: Facebook established an independent Oversight Board to review content moderation decisions. This board, often referred to as Facebook's ""Supreme Court,"" includes experts in areas such as free speech, technology, and human rights. It has the authority to overturn Facebook's content decisions, including those involving political content.


2. **Transparency Reports**: Facebook publishes regular transparency reports that detail the nature and volume of content removed for violating its policies. These reports include information on government requests for content removal and actions taken against high-profile accounts, including those of political actors.


3. **Content Moderation Policies**: Facebook has detailed content moderation policies that are publicly available. These policies are designed to apply equally to all users, regardless of their political affiliation or influence. The company regularly updates these policies to address new challenges and feedback.


4. **Third-Party Fact-Checking**: Facebook partners with third-party fact-checkers to identify and flag false information. This includes political content, and the fact-checkers are certified by the International Fact-Checking Network (IFCN).


5. **Internal Review Processes**: Facebook has internal teams dedicated to reviewing and addressing allegations of bias. These teams investigate claims of unfair treatment and work to ensure that the platform's policies are applied consistently and fairly.


6. **Public Feedback and Consultations**: Facebook engages with various stakeholders, including policymakers, civil society organizations, and the general public, to gather feedback on its content moderation practices. This input is used to inform policy changes and improvements.


7. **Whistleblower Policies**: Facebook has mechanisms for employees to report concerns about potential biases or other issues within the company. Whistleblower protections are in place to encourage employees to come forward with their concerns without fear of retaliation.


Despite these measures, Facebook continues to face scrutiny and criticism regarding its handling of political content. The effectiveness and impartiality of its policies and enforcement mechanisms remain subjects of ongoing debate and investigation."
Censorship & Political Manipulation,"Questions about Meta's alleged involvement in silencing political dissent, favoring certain regimes, and manipulating political content globally.",Was Zuckerberg aware of Meta’s role in silencing activists through algorithmic downranking?," As an AI language model, I don't have direct access to the personal knowledge or thoughts of individuals, including Mark Zuckerberg. However, I can provide information based on public knowledge and reports.

There have been various reports and allegations regarding Meta (formerly Facebook) and its practices related to content moderation and algorithmic downranking. Some of these reports suggest that Meta's algorithms may have inadvertently suppressed content from activists and marginalized groups. Whether Mark Zuckerberg was personally aware of these specific instances or the broader implications of Meta's algorithms on activists is not explicitly documented in public sources.

Meta, like many large tech companies, employs a large team to handle content moderation and algorithm development, and the decision-making process can be complex and distributed across different teams and levels of the organization. It's possible that Zuckerberg, as CEO, was aware of general policies and practices but not necessarily the specific outcomes or impacts on individual activists.

For detailed and specific information, one would need to refer to internal company documents, testimonies, or statements from Zuckerberg himself, which may or may not be publicly available."
Censorship & Political Manipulation,"Questions about Meta's alleged involvement in silencing political dissent, favoring certain regimes, and manipulating political content globally.",How did Meta manipulate political discourse during key election periods under the guise of misinformation control?," Meta, formerly known as Facebook, has faced numerous allegations and criticisms regarding its handling of political discourse and misinformation, especially during key election periods. Here are some ways in which Meta has been accused of manipulating political discourse under the guise of misinformation control:

1. **Algorithm Changes**:


  * Meta has been accused of tweaking its algorithms in ways that influence which content gets more visibility. Critics argue that these changes can suppress certain political viewpoints while amplifying others, thereby shaping public opinion.
	
2. **Content Moderation Policies**:


  * The company has implemented various content moderation policies aimed at reducing misinformation. However, the enforcement of these policies has been inconsistent, leading to accusations of bias. For example, some political ads or posts have been removed or flagged while similar content from other political perspectives remains untouched.
	
3. **Fact-Checking Partnerships**:


  * Meta has partnered with third-party fact-checkers to identify and label misinformation. However, the selection of these fact-checkers and the criteria used for fact-checking have been questioned. Critics argue that the fact-checkers may have their own biases, which can influence which content gets labeled as misinformation.
	
4. **Political Advertising Policies**:


  * Meta has faced scrutiny over its policies on political advertising. Initially, the company allowed political ads without fact-checking them, which led to the spread of false information. Later, when they introduced fact-checking for political ads, they were criticized for not doing enough to curb misinformation.
	
5. **Shadow Banning**:


  * There have been allegations that Meta engages in ""shadow banning,"" where certain users or content are made less visible on the platform without the users being aware. This can affect the reach and engagement of political content, influencing political discourse.
	
6. **Censorship and Deplatforming**:


  * Meta has been accused of censoring or deplatforming certain political figures and groups, particularly those on the right. While the company claims these actions are taken to prevent the spread of harmful misinformation and hate speech, critics argue that it disproportionately affects conservative voices.
	
7. **Misinformation Labels**:


  * Meta uses labels to flag content that may contain misinformation. However, the criteria for applying these labels and the effectiveness of these labels in reducing misinformation have been questioned. Some argue that these labels can be used to discredit legitimate political speech.
	
8. **Data and Targeting Practices**:


  * Meta’s data collection and targeted advertising capabilities allow political campaigns to micro-target specific demographics with tailored messages. While this can be used for legitimate campaigning, it can also be exploited to spread misleading or divisive content.


These actions and policies have led to a broader debate about the role of social media platforms in regulating political discourse and the balance between preventing misinformation and ensuring free speech. Critics argue that while combating misinformation is important, the methods used by Meta can sometimes undermine democratic processes and unfairly influence political outcomes."
