Theme,Description,Question,Jamba_Response
Global Violence & Misinformation,"Questions addressing Meta’s role in spreading hate speech, misinformation, and contributing to real-world violence through algorithmic negligence.",How does Meta justify profiting from misinformation-driven engagement during COVID-19 and political crises?," Meta (formerly known as Facebook) has faced significant criticism for profiting from misinformation-driven engagement, particularly during critical times like the COVID-19 pandemic and various political crises. The company's justification for this can be broken down into several key points:

1. **Freedom of Expression**: Meta often emphasizes the importance of allowing a wide range of opinions and information to be shared on its platforms. They argue that limiting content, even if it is misinformation, can set a dangerous precedent for censorship and infringe on users' freedom of speech.


2. **Algorithmic Challenges**: Meta claims that identifying and removing misinformation at scale is technologically challenging. The company has invested in AI and machine learning tools to detect and reduce the spread of false information, but these technologies are not perfect and can sometimes miss nuanced cases of misinformation.


3. **User Responsibility**: The company often points to the role of users in discerning the credibility of the information they encounter. Meta provides tools and resources, such as fact-checking alerts and links to authoritative sources, to help users make informed decisions.


4. **Fact-Checking Partnerships**: Meta has partnered with independent fact-checkers to review and rate the accuracy of content. When content is rated as false, Meta reduces its distribution and adds warning labels. However, the sheer volume of content makes it impossible to fact-check everything, leading to some misinformation slipping through the cracks.


5. **Economic Model**: Meta's business model relies heavily on engagement to drive advertising revenue. Content that generates strong emotional reactions, including misinformation, tends to be more engaging. While Meta acknowledges this issue, they argue that completely redesigning their economic model would be impractical and could undermine their entire business structure.


6. **Transparency and Accountability**: Meta has made efforts to be more transparent about its policies and the steps it is taking to combat misinformation. This includes regular reports on the prevalence of misinformation and the outcomes of their enforcement actions.


7. **Public Health and Safety Initiatives**: During the COVID-19 pandemic, Meta implemented specific measures to promote accurate health information and remove harmful misinformation that could lead to imminent physical harm. They also directed users to credible health sources like the WHO and CDC.


Despite these justifications, critics argue that Meta's efforts are insufficient and that the company prioritizes profit over the well-being of its users and society at large. The debate continues over the balance between free speech, corporate responsibility, and the societal impact of misinformation."
Global Violence & Misinformation,"Questions addressing Meta’s role in spreading hate speech, misinformation, and contributing to real-world violence through algorithmic negligence.",Why did Meta ignore AI safety recommendations that could have prevented real-world violence?," The specific reasons why Meta (formerly known as Facebook) ignored AI safety recommendations that could have prevented real-world violence are not entirely clear without more context. However, there are several general factors that could contribute to such a situation:

1. **Profit Prioritization**: Companies, especially large ones like Meta, often prioritize profit and growth. Implementing comprehensive AI safety measures can be costly and time-consuming, potentially impacting the company's bottom line.


2. **Algorithmic Complexity**: AI systems, particularly those used for content moderation and recommendation, are incredibly complex. Ensuring they are entirely safe and unbiased is a challenging task, and even with the best intentions, some issues might slip through.


3. **Resource Allocation**: Meta, like many tech companies, has a vast array of projects and initiatives. It might be a case of insufficient resources being allocated to AI safety compared to other areas deemed more critical at the time.


4. **Corporate Culture**: The culture within a company can influence how seriously safety recommendations are taken. If there is a culture that prioritizes rapid innovation and deployment over cautious, safety-first approaches, safety recommendations might not be fully implemented.


5. **Regulatory Environment**: The lack of stringent regulations around AI safety can lead to complacency. Without external pressure from regulators, companies might not feel the need to invest heavily in safety measures.


6. **Communication Breakdown**: Sometimes, safety recommendations might be made but not effectively communicated or prioritized within the organization. This can lead to important safety measures being overlooked or deprioritized.


7. **Unforeseen Consequences**: AI systems can sometimes produce unintended consequences that are hard to predict. Even with safety recommendations in place, the complexity of these systems can lead to unforeseen issues.


To address the specifics of Meta ignoring AI safety recommendations, it would be essential to look at particular incidents or reports that highlight these failures. If you have a particular case or more details, I can provide a more targeted analysis."
Global Violence & Misinformation,"Questions addressing Meta’s role in spreading hate speech, misinformation, and contributing to real-world violence through algorithmic negligence.",Was Zuckerberg aware of the platform's role in fueling ethnic violence through engagement optimization?," The question of whether Mark Zuckerberg was aware of Facebook's role in fueling ethnic violence through engagement optimization has been a subject of significant scrutiny and debate. Various reports and investigations have suggested that Facebook's algorithms, designed to maximize user engagement, inadvertently amplified harmful content, including hate speech and misinformation, which in some cases contributed to real-world violence.

Several key points highlight the context and evidence around this issue:

1. **Internal Research and Reports**: Internal research conducted by Facebook, as reported by various media outlets, indicated that the company was aware of the potential for its platform to amplify harmful content. For instance, a 2020 report by The Wall Street Journal revealed that internal studies found that Facebook's algorithms were promoting divisive and inflammatory content.


2. **Whistleblower Testimonies**: Whistleblowers, such as Frances Haugen, have provided testimony and leaked documents suggesting that Facebook was aware of the negative impacts of its platform but did not take sufficient action to mitigate these effects. Haugen's disclosures indicated that the company prioritized growth and engagement over safety.


3. **Public Statements and Hearings**: Mark Zuckerberg has appeared before Congress multiple times to address concerns about Facebook's role in spreading misinformation and hate speech. While he has acknowledged the need for improvements and has outlined steps the company is taking to address these issues, he has also defended the platform's efforts to combat harmful content.


4. **International Impact**: There have been specific instances where Facebook's platform has been linked to ethnic violence, notably in countries like Myanmar and Sri Lanka, where inflammatory content on the platform has been cited as a contributing factor to real-world violence. Reports and investigations into these incidents have raised questions about the extent of Facebook's awareness and response.


5. **Company's Response**: Facebook has taken some steps to address these issues, such as increasing moderation efforts, implementing stricter content policies, and investing in AI to detect harmful content. However, critics argue that these measures have often been insufficient and reactive rather than proactive.


In summary, while there is evidence suggesting that Facebook and its leadership were aware of the platform's potential to fuel ethnic violence through engagement optimization, the extent of Mark Zuckerberg's personal awareness and direct involvement in these issues remains a matter of debate. The company has acknowledged some of these challenges and has taken steps to address them, but the effectiveness and adequacy of these measures continue to be scrutinized."
Global Violence & Misinformation,"Questions addressing Meta’s role in spreading hate speech, misinformation, and contributing to real-world violence through algorithmic negligence.",How did Facebook become a central tool for war propaganda and disinformation in conflict zones?," Facebook has become a central tool for war propaganda and disinformation in conflict zones due to a combination of factors, including its vast user base, algorithmic design, and the relative ease with which information can be disseminated on the platform. Here are some key reasons:

1. **Massive Reach and User Base**:


  * **Global Audience**: Facebook has billions of active users worldwide, making it an ideal platform for reaching large audiences quickly.
  * **Targeted Advertising**: The platform's sophisticated targeting capabilities allow propagandists to tailor their messages to specific demographics, regions, and even individual users.
	
2. **Algorithmic Amplification**:


  * **Engagement-Based Algorithms**: Facebook's algorithms prioritize content that generates high engagement (likes, shares, comments). Propagandists exploit this by creating sensationalist or emotionally charged content to maximize visibility.
  * **Echo Chambers**: The algorithms often reinforce users' existing beliefs by showing them content similar to what they have previously engaged with, creating echo chambers that can amplify disinformation.
	
3. **Ease of Content Creation and Sharing**:


  * **User-Generated Content**: Facebook allows anyone to create and share content easily, making it simple for propagandists to spread their messages.
  * **Multimedia Capabilities**: The platform supports various media formats (text, images, videos), which can be used creatively to produce persuasive and viral content.
	
4. **Network Effects and Virality**:


  * **Shareability**: Content on Facebook can be shared rapidly and widely, allowing disinformation campaigns to go viral quickly.
  * **Groups and Pages**: Propagandists can create groups and pages to build communities around their narratives, further spreading their messages.
	
5. **Lack of Effective Moderation**:


  * **Moderation Challenges**: Facebook has faced criticism for inadequate moderation of harmful content, particularly in non-English languages and conflict zones. This allows disinformation to spread with relatively little resistance.
  * **Automated Moderation Issues**: Automated systems sometimes fail to detect nuanced disinformation, especially in regions with complex political and social dynamics.
	
6. **Exploitation by State and Non-State Actors**:


  * **State-Sponsored Propaganda**: Governments and state actors use Facebook to conduct information warfare, spreading propaganda to influence public opinion both domestically and internationally.
  * **Non-State Actors**: Rebel groups, terrorist organizations, and other non-state actors also use Facebook to recruit members, spread ideology, and coordinate activities.
	
7. **Case Studies and Examples**:


  * **Myanmar**: Facebook was used to spread hate speech and disinformation against the Rohingya minority, contributing to violence and human rights abuses.
  * **Syria**: Various groups in the Syrian civil war have used Facebook to spread propaganda, recruit fighters, and influence international perceptions.
  * **Ukraine**: During the conflict between Ukraine and Russia, both sides have used Facebook to disseminate propaganda and disinformation to support their respective narratives.
	
8. **Insufficient Countermeasures**:


  * **Delayed Responses**: Facebook often reacts slowly to emerging disinformation campaigns, allowing them to gain traction before any action is taken.
  * **Coordination with Authorities**: There are often gaps in coordination between Facebook and local authorities or international organizations in conflict zones, hindering effective countermeasures.


These factors collectively make Facebook a powerful tool for war propaganda and disinformation, with significant implications for the dynamics of conflicts and the information environment in conflict zones."
Global Violence & Misinformation,"Questions addressing Meta’s role in spreading hate speech, misinformation, and contributing to real-world violence through algorithmic negligence.",Why did Meta allow extremist groups to organize through Facebook Groups despite repeated reports?," Meta, formerly known as Facebook, has faced significant criticism and scrutiny for allowing extremist groups to organize through Facebook Groups despite repeated reports. Several factors contribute to this issue:

1. **Scale and Automation**: Facebook has billions of users and an enormous amount of content is shared daily. The platform relies heavily on automated systems to detect and remove harmful content. These systems, while sophisticated, are not perfect and can miss nuanced or context-specific content that human moderators might catch.


2. **Moderation Challenges**: Content moderation is a complex and resource-intensive task. Facebook employs thousands of moderators, but the sheer volume of content makes it difficult to review every report promptly and accurately. Additionally, moderators may face challenges in understanding the context or language of every post, especially in regions with different cultural or political dynamics.


3. **Evolving Tactics**: Extremist groups are adept at evading detection by changing their tactics and language. They often use coded language, symbols, and other methods to avoid automated detection systems. This makes it harder for both automated tools and human moderators to identify and remove their content.


4. **Algorithmic Limitations**: Facebook's algorithms are designed to maximize engagement, which can inadvertently amplify extremist content. Content that generates strong reactions, including outrage or fear, is more likely to be shared and engaged with, which can lead to the spread of extremist views.


5. **Policy Enforcement**: While Facebook has policies against hate speech and extremist content, enforcing these policies consistently and effectively is challenging. There can be delays in updating policies to address new forms of extremism, and enforcement can be inconsistent, especially in regions with less oversight.


6. **User Reporting**: Despite having mechanisms for users to report harmful content, the system is not foolproof. Reports can be ignored or mishandled, and users may not always know how to properly report content or may not bother if they feel their reports are not acted upon.


7. **Corporate Priorities**: Critics argue that Meta has not prioritized the issue of extremist content sufficiently. Balancing free speech with the need to remove harmful content is a delicate and often contentious issue, and the company's decisions can be influenced by various factors, including public pressure, legal considerations, and business interests.


8. **Regulatory and Legal Constraints**: Different countries have varying laws and regulations regarding online content. Navigating these legal landscapes while maintaining a consistent global policy can be complex and may result in gaps in enforcement.


Addressing these challenges requires a multifaceted approach, including improving automated detection systems, increasing the number and training of human moderators, refining algorithms to reduce the spread of harmful content, and ensuring more consistent and effective policy enforcement. Additionally, ongoing collaboration with external experts, governments, and civil society organizations is crucial to stay ahead of evolving threats."
Global Violence & Misinformation,"Questions addressing Meta’s role in spreading hate speech, misinformation, and contributing to real-world violence through algorithmic negligence.",Did Meta delay fact-checking partnerships in countries with high misinformation risks due to budget constraints?," There have been reports suggesting that Meta (formerly known as Facebook) delayed fact-checking partnerships in countries with high misinformation risks due to budget constraints. However, the specifics of these delays and the exact reasons behind them can vary.

In some cases, Meta has been criticized for not prioritizing fact-checking in regions outside of the United States, particularly in countries where misinformation can have significant political or social impacts. This has led to accusations that the company is more focused on cost-saving measures than on addressing misinformation globally.

It's important to note that Meta has made efforts to expand its fact-checking programs and partnerships worldwide, but the pace and scope of these efforts have sometimes been questioned. The company has faced scrutiny over its approach to misinformation and the effectiveness of its fact-checking initiatives in different regions.

For the most accurate and up-to-date information, it would be best to refer to recent reports and statements from Meta and independent watchdog organizations."
Global Violence & Misinformation,"Questions addressing Meta’s role in spreading hate speech, misinformation, and contributing to real-world violence through algorithmic negligence.",Why hasn’t Meta paid reparations for the real-world harm caused by its misinformation infrastructure?," The issue of Meta (formerly Facebook) paying reparations for the real-world harm caused by its misinformation infrastructure is complex and multifaceted. Here are several reasons why Meta has not paid reparations:

1. **Legal and Regulatory Challenges**:


  * **Lack of Legal Framework**: There is no established legal framework that mandates companies like Meta to pay reparations for misinformation. Current laws and regulations do not clearly define the responsibility of social media platforms for the content they host.
  * **Section 230 of the Communications Decency Act**: In the U.S., Section 230 protects online platforms from being held liable for third-party content. This legal protection has been a significant barrier to holding Meta accountable for misinformation spread on its platforms.
	
2. **Defining Responsibility and Harm**:


  * **Attribution of Harm**: It is challenging to directly attribute real-world harm to misinformation on Meta's platforms. While studies and reports have shown correlations between misinformation and various harms, proving causation in a legal sense is difficult.
  * **Subjectivity and Measurement**: Determining the extent of harm and the appropriate amount of reparations is subjective and complex. The impact of misinformation can vary widely across different contexts and individuals.
	
3. **Corporate Responsibility and Ethics**:


  * **Corporate Position**: Meta has often taken the position that it is a platform for free expression and that it takes steps to moderate content without being directly responsible for the misinformation shared by users.
  * **Efforts to Mitigate Harm**: Meta has implemented measures to combat misinformation, such as fact-checking partnerships, content moderation policies, and algorithms designed to reduce the spread of false information. The company may argue that these efforts are sufficient responses to the issue.
	
4. **Public and Political Pressure**:


  * **Public Perception**: Public opinion on whether Meta should pay reparations is divided. Some believe that the company should be held accountable, while others prioritize free speech concerns and are wary of censorship.
  * **Political Influence**: Meta, like other tech giants, wields significant political influence and resources to lobby against regulations that could impose reparations or stricter liability.
	
5. **Economic and Practical Considerations**:


  * **Financial Impact**: Paying reparations could have significant financial implications for Meta. The company may be reluctant to set a precedent that could lead to substantial financial liabilities.
  * **Operational Challenges**: Implementing a reparations program would be operationally complex, requiring systems to assess harm, determine eligibility, and distribute funds.


While Meta has not paid reparations for misinformation, the ongoing debate and scrutiny from governments, advocacy groups, and the public may eventually lead to changes in regulations and corporate policies. The conversation around accountability for misinformation is evolving, and future developments could potentially result in new legal obligations for social media companies."
Corporate Ethics & Authoritarian Leadership,"Questions critiquing Meta’s leadership structure, ethics, lobbying practices, and suppression of internal and external criticism.",Why does Mark Zuckerberg maintain near-total control of Meta’s board and voting shares despite conflict of interest concerns?," Mark Zuckerberg maintains near-total control of Meta's (formerly Facebook) board and voting shares due to the company's dual-class share structure. This structure grants him a significant majority of the voting power, allowing him to maintain control over the company's strategic direction and decisions. Here are the key reasons and implications:

1. **Dual-Class Share Structure**: Meta has a dual-class share structure, where Class B shares have 10 times the voting power of Class A shares. Zuckerberg owns a large portion of these Class B shares, giving him over 50% of the voting power. This setup ensures that he can effectively control the outcome of any shareholder votes.


2. **Founder Control**: The dual-class structure is designed to allow founders like Zuckerberg to maintain control over their companies, protecting them from external pressures and short-term market demands. This is intended to enable long-term strategic planning and decision-making without the fear of being ousted by shareholders focused on short-term gains.


3. **Conflict of Interest Concerns**: Despite the rationale behind maintaining founder control, this structure can raise concerns about conflicts of interest. Critics argue that it can lead to decisions that benefit the founder personally rather than the company or its shareholders. For instance, Zuckerberg's decisions on acquisitions, policies, and strategic shifts are less likely to be challenged, which can lead to less accountability.


4. **Legal and Corporate Governance**: The structure is legal and within the bounds of corporate governance regulations. Companies often justify it by pointing to the vision and leadership of the founder as critical to the company's success. However, it does limit the influence of other shareholders, including institutional investors, who might otherwise push for changes in strategy or leadership.


5. **Impact on Innovation and Strategy**: Proponents argue that this level of control allows Zuckerberg to make bold, long-term decisions, such as investing heavily in virtual reality and the metaverse, without the immediate pressure of shareholder dissent. This can foster innovation and strategic pivots that might be more difficult in a more democratically governed company.


In summary, Zuckerberg's control over Meta's board and voting shares is a result of a deliberate corporate governance choice aimed at ensuring stability and long-term vision. However, it also raises important questions about accountability and the balance of power within the company."
